Sheet: Anleitung
A1: 1. Füllen Sie nur die gelben Felder aus
A2: 2. Verwenden Sie die rechststehende Skala (Englische Anleitung ausführlicher als Deutsche)
A3: 3. Wählen Sie eine gelbe Zelle aus und Vergleichen Sie das Kriterium aus der anliegende Zeile mit dem Kriterium aus der anliegenden Spalte
A4: 4. Tragen Sie einen Wert aus der Skala in die Zelle ein, welcher Ihren Präferenzen entspricht
A5: 5. Wiederholen Sie die Schritte bis alle gelben Felder ausgefühllt sind
A16: Beispiel:
A18: Item Number | B18: Item Number | C18: 1 | D18: 2 | E18: 3
B19: Item Description | C19: =T(R[1]C[-1]) -> Menge der Apps | D19: =T(R[2]C[-2]) -> Entwicklungsumgebung | E19: =T(R[3]C[-3]) -> Unterstütze Beriebssysteme
A20: 1 | B20: Menge der Apps | C20: 1 | D20: 7 | E20: 8
A21: 2 | B21: Entwicklungsumgebung | C21: =IF(R[-1]C[1]="","",1/R[-1]C[1]) -> 0.14285714285714285 | D21: 1 | E21: 1
A22: 3 | B22: Unterstütze Beriebssysteme | C22: =IF(R[-2]C[2]="","",1/R[-2]C[2]) -> 0.125 | D22: =IF(R[-1]C[1]="","",1/R[-1]C[1]) -> 1 | E22: 1
A23: 5 | B23: Sum | C23: =IF(R[-3]C="","",SUM(R[-3]C:R[-1]C)) -> 1.2678571428571428 | D23: =IF(R[-3]C="","",SUM(R[-3]C:R[-1]C)) -> 9 | E23: =IF(R[-3]C="","",SUM(R[-3]C:R[-1]C)) -> 10
H27: Rating Scale
H30: Rating | I30: Definition
H31: 9 | I31: Row extremely more important
H32: 8 | I32: Row very strongly to extremely more important
H33: 7 | I33: Row very strongly more important
H34: 6 | I34: Row strongly to very strongly more important
H35: 5 | I35: Row strongly more important
H36: 4 | I36: Row moderately to strongly more important
H37: 3 | I37: Row moderately more important
H38: 2 | I38: Row equally important to moderately more important
H39: 1 | I39: Row and column equally important
H40: 1/2 | I40: Column equally important to moderately more important
H41: 1/3 | I41: Column moderately more important
H42: 1/4 | I42: Column moderately to strongly more important
H43: 1/5 | I43: Column strongly more important
H44: 1/6 | I44: Column strongly to very strongly more important
H45: 1/7 | I45: Column very strongly more important
H46: 1/8 | I46: Column very strongly to extremely more important
H47: 1/9 | I47: Column extremely more important

Sheet: Gewichtung Tragekomfort
C1: CR Value = | D1: =R[22]C[5] -> #DIV/0! | F1: =IF(RC[-2]<0.1,"Reasonable Consistency","Not Consistent") -> #DIV/0!
C2: Pairwise comparisons
A3: Item Number | C3: Item Number | D3: 1 | E3: 2 | I3: ONLY ENTER in the yellow fields
C4: Item Description | D4: Gewicht | E4: Polsterung | I4: Item Descriptions can be text
A5: 1 | B5: Gewicht der Brille | C5: Gewicht | D5: 1
A6: 2 | B6: Wie bequem ist die Polsterung? | C6: Polsterung | D6: =IF(R[-1]C[1]="","",1/R[-1]C[1]) ->  | E6: 1
C7: Sum | D7: =IF(R[-2]C="","",SUM(R[-2]C:R[-1]C)) -> 1 | E7: =IF(R[-2]C="","",SUM(R[-2]C:R[-1]C)) -> 
C9: STANDARDIZED MATRIX
D10: =R[-6]C -> Gewicht | E10: =R[-6]C -> Polsterung | F10: Weight
A11: 1 | B11: Gewicht der Brille | C11: =IF(R[-6]C="","",R[-6]C) -> Gewicht | D11: =IF(R[-6]C="","",R[-6]C/R7C4) -> 1 | E11: =IF(R[-6]C="","",R[-6]C/R7C) ->  | F11: =IF(RC[-2]="","",(SUM(RC[-2]:RC[-1])/R20C9)) -> 0.5
A12: 2 | B12: Wie bequem ist die Polsterung? | C12: =IF(R[-6]C="","",R[-6]C) -> Polsterung | D12: =IF(R[-6]C="","",R[-6]C/R7C4) ->  | E12: =IF(R[-7]C="","",R[-6]C/R7C5) ->  | F12: =IF(RC[-2]="","",(SUM(RC[-2]:RC[-1])/R20C9)) -> 
C15: CI and CR worksheet
D16: =R[-6]C -> Gewicht | E16: =R[-6]C -> Polsterung | F16: SUM | G16: SUM/Weight
A17: 1 | B17: Gewicht der Brille | C17: =R[-6]C -> Gewicht | D17: =IF(R[-12]C="","",R[-12]C*R11C6) -> 0.5 | E17: =IF(R[-12]C="","",R[-12]C*R12C6) ->  | F17: =IF(RC[-2]="","",SUM(RC[-2]:RC[-1])) -> 0.5 | G17: =IF(RC[-1]="","",RC[-1]/R[-6]C6) -> 1
A18: 2 | B18: Wie bequem ist die Polsterung? | C18: =R[-6]C -> Polsterung | D18: =IF(R[-12]C="","",R[-12]C*R11C6) ->  | E18: =IF(R[-13]C="","",R[-12]C*R12C6) ->  | F18: =IF(RC[-2]="","",SUM(RC[-2]:RC[-1])) ->  | G18: =IF(RC[-1]="","",RC[-1]/R[-6]C6) -> 
H20: count | I20: =COUNTA(R[-15]C[-6]:R[-14]C[-6]) -> 2
H21: lambda max | I21: =(SUM(R[-4]C[-2]:R[-3]C[-2]))/(COUNT(R[-4]C[-2]:R[-3]C[-2])) -> 1
H22: CI | I22: =(R[-1]C-R[-2]C)/(R[-2]C-1) -> -1
H23: CR | I23: =R[-1]C/R[1]C -> #DIV/0!
H24: constant | I24: =IF(R[-4]C=R[5]C[-6],R[5]C[-5],IF(R[-4]C=R[6]C[-6],R[6]C[-5],IF(R[-4]C=R[7]C[-6],R[7]C[-5],IF(R[-4]C=R[8]C[-6],R[8]C[-5],IF(R[-4]C=R[9]C[-6],R[9]C[-5],IF(R[-4]C=R[10]C[-6],R[10]C[-5],IF(R[-4]C=R[11]C[-6],R[11]C[-5],IF(R[-4]C=R[12]C[-6],R[12]C[-5],R[13]C[-5])))))))) -> 0
C26: Saaty’s CIr values for matrices are given by the following table
C27: Anzahl der Dimensionen n | D27: Random Consistency
C28: 1 | D28: 0 | E28: 1
C29: 2 | D29: 0 | E29: 2
C30: 3 | D30: 0.57999999999999996 | E30: 3
C31: 4 | D31: 0.9 | E31: 4
C32: 5 | D32: 1.1200000000000001 | E32: 5
C33: 6 | D33: 1.24 | E33: 6
C34: 7 | D34: 1.32 | E34: 7
C35: 8 | D35: 1.41 | E35: 8
C36: 9 | D36: 1.45 | E36: 9
C37: 10 | D37: 1.49 | E37: 10

Sheet: GewichtungQualitätDerImmersio
C1: CR Value = | D1: =R[31]C[6] -> -0.89285714285714279 | F1: =IF(RC[-2]<0.1,"Reasonable Consistency","Not Consistent") -> Reasonable Consistency
C2: Pairwise comparisons
A3: Item Number | C3: Item Number | D3: 1 | E3: 2 | F3: 3 | G3: 4 | H3: 5 | L3: ONLY ENTER in the yellow fields
C4: Item Description | D4: =T(R[1]C[-1]) -> Displayauflösung | E4: =T(R[2]C[-2]) -> Qualität der Texturen | F4: =T(R[3]C[-3]) -> Präzession des Trackings | G4: =T(R[4]C[-4]) -> FPS | H4: =T(R[5]C[-5]) -> Sichtfeld | L4: Item Descriptions can be text
A5: 1 | C5: Displayauflösung | D5: 1
A6: 2 | B6: Wie aufwändig ist die Grafik der Simulation | C6: Qualität der Texturen | D6: =IF(R[-1]C[1]="","",1/R[-1]C[1]) ->  | E6: 1
A7: 3 | B7: Wie präzise kann die Simulation meinen Kopfbewegungen folgen | C7: Präzession des Trackings | D7: =IF(R[-2]C[2]="","",1/R[-2]C[2]) ->  | E7: =IF(R[-1]C[1]="","",1/R[-1]C[1]) ->  | F7: 1
A8: 4 | B8: Bilder pro Sekunde | C8: FPS | D8: =IF(R[-3]C[3]="","",1/R[-3]C[3]) ->  | E8: =IF(R[-2]C[2]="","",1/R[-2]C[2]) ->  | F8: =IF(R[-1]C[1]="","",1/R[-1]C[1]) ->  | G8: 1
A9: 5 | B9: Welches Sichtfeld bietet die Darstellung durch die Brille | C9: Sichtfeld | D9: =IF(R[-4]C[4]="","",1/R[-4]C[4]) ->  | E9: =IF(R[-3]C[3]="","",1/R[-3]C[3]) ->  | F9: =IF(R[-2]C[2]="","",1/R[-2]C[2]) ->  | G9: =IF(R[-1]C[1]="","",1/R[-1]C[1]) ->  | H9: 1
C10: Sum | D10: =IF(R[-5]C="","",SUM(R[-5]C:R[-1]C)) -> 1 | E10: =IF(R[-5]C="","",SUM(R[-5]C:R[-1]C)) ->  | F10: =IF(R[-5]C="","",SUM(R[-5]C:R[-1]C)) ->  | G10: =IF(R[-5]C="","",SUM(R[-5]C:R[-1]C)) ->  | H10: =IF(R[-5]C="","",SUM(R[-5]C:R[-1]C)) -> 
C12: STANDARDIZED MATRIX
D13: =R[-9]C -> Displayauflösung | E13: =R[-9]C -> Qualität der Texturen | F13: =R[-9]C -> Präzession des Trackings | G13: =R[-9]C -> FPS | H13: =R[-9]C -> Sichtfeld | I13: Weight
A14: 1 | C14: =IF(R[-9]C="","",R[-9]C) -> Displayauflösung | D14: =IF(R[-9]C="","",R[-9]C/R10C4) -> 1 | E14: =IF(R[-9]C="","",R[-9]C/R10C) ->  | F14: =IF(R[-9]C="","",R[-9]C6/R10C) ->  | G14: =IF(R[-9]C="","",R[-9]C7/R10C) ->  | H14: =IF(R[-9]C="","",R[-9]C8/R10C) ->  | I14: =IF(RC[-5]="","",(SUM(RC[-5]:RC[-1])/R29C10)) -> 0.2
A15: 2 | B15: Wie aufwändig ist die Grafik der Simulation | C15: =IF(R[-9]C="","",R[-9]C) -> Qualität der Texturen | D15: =IF(R[-9]C="","",R[-9]C/R10C4) ->  | E15: =IF(R[-10]C="","",R[-9]C/R10C5) ->  | F15: =IF(R[-9]C="","",R[-9]C6/R10C) ->  | G15: =IF(R[-9]C="","",R[-9]C7/R10C) ->  | H15: =IF(R[-9]C="","",R[-9]C8/R10C) ->  | I15: =IF(RC[-5]="","",(SUM(RC[-5]:RC[-1])/R29C10)) -> 
A16: 3 | B16: Wie präzise kann die Simulation meinen Kopfbewegungen folgen | C16: =IF(R[-9]C="","",R[-9]C) -> Präzession des Trackings | D16: =IF(R[-9]C="","",R[-9]C/R10C4) ->  | E16: =IF(R[-9]C="","",R[-9]C/R10C5) ->  | F16: =IF(R[-11]C="","",R[-9]C6/R10C) ->  | G16: =IF(R[-9]C="","",R[-9]C7/R10C) ->  | H16: =IF(R[-9]C="","",R[-9]C8/R10C) ->  | I16: =IF(RC[-5]="","",(SUM(RC[-5]:RC[-1])/R29C10)) -> 
A17: 4 | B17: Bilder pro Sekunde | C17: =IF(R[-9]C="","",R[-9]C) -> FPS | D17: =IF(R[-9]C="","",R[-9]C/R10C4) ->  | E17: =IF(R[-9]C="","",R[-9]C/R10C5) ->  | F17: =IF(R[-9]C="","",R[-9]C6/R10C) ->  | G17: =IF(R[-12]C="","",R[-9]C7/R10C) ->  | H17: =IF(R[-9]C="","",R[-9]C8/R10C) ->  | I17: =IF(RC[-5]="","",(SUM(RC[-5]:RC[-1])/R29C10)) -> 
A18: 5 | B18: Welches Sichtfeld bietet die Darstellung durch die Brille | C18: =IF(R[-9]C="","",R[-9]C) -> Sichtfeld | D18: =IF(R[-9]C="","",R[-9]C/R10C4) ->  | E18: =IF(R[-9]C="","",R[-9]C/R10C5) ->  | F18: =IF(R[-9]C="","",R[-9]C6/R10C) ->  | G18: =IF(R[-9]C="","",R[-9]C7/R10C) ->  | H18: =IF(R[-13]C="","",R[-9]C8/R10C) ->  | I18: =IF(RC[-5]="","",(SUM(RC[-5]:RC[-1])/R29C10)) -> 
C21: CI and CR worksheet
D22: =R[-9]C -> Displayauflösung | E22: =R[-9]C -> Qualität der Texturen | F22: =R[-9]C -> Präzession des Trackings | G22: =R[-9]C -> FPS | H22: =R[-9]C -> Sichtfeld | I22: SUM | J22: SUM/Weight
A23: 1 | C23: =R[-9]C -> Displayauflösung | D23: =IF(R[-18]C="","",R[-18]C*R14C9) -> 0.2 | E23: =IF(R[-18]C="","",R[-18]C*R15C9) ->  | F23: =IF(R[-18]C="","",R[-18]C*R16C9) ->  | G23: =IF(R[-18]C="","",R[-18]C*R17C9) ->  | H23: =IF(R[-18]C="","",R[-18]C*R18C9) ->  | I23: =IF(RC[-5]="","",SUM(RC[-5]:RC[-1])) -> 0.2 | J23: =IF(RC[-1]="","",RC[-1]/R[-9]C9) -> 1
A24: 2 | B24: Wie aufwändig ist die Grafik der Simulation | C24: =R[-9]C -> Qualität der Texturen | D24: =IF(R[-18]C="","",R[-18]C*R14C9) ->  | E24: =IF(R[-19]C="","",R[-18]C*R15C9) ->  | F24: =IF(R[-18]C="","",R[-18]C*R16C9) ->  | G24: =IF(R[-18]C="","",R[-18]C*R17C9) ->  | H24: =IF(R[-18]C="","",R[-18]C*R18C9) ->  | I24: =IF(RC[-5]="","",SUM(RC[-5]:RC[-1])) ->  | J24: =IF(RC[-1]="","",RC[-1]/R[-9]C9) -> 
A25: 3 | B25: Wie präzise kann die Simulation meinen Kopfbewegungen folgen | C25: =R[-9]C -> Präzession des Trackings | D25: =IF(R[-18]C="","",R[-18]C*R14C9) ->  | E25: =IF(R[-18]C="","",R[-18]C*R15C9) ->  | F25: =IF(R[-20]C="","",R[-18]C*R16C9) ->  | G25: =IF(R[-18]C="","",R[-18]C*R17C9) ->  | H25: =IF(R[-18]C="","",R[-18]C*R18C9) ->  | I25: =IF(RC[-5]="","",SUM(RC[-5]:RC[-1])) ->  | J25: =IF(RC[-1]="","",RC[-1]/R[-9]C9) -> 
A26: 4 | B26: Bilder pro Sekunde | C26: =R[-9]C -> FPS | D26: =IF(R[-18]C="","",R[-18]C*R14C9) ->  | E26: =IF(R[-18]C="","",R[-18]C*R15C9) ->  | F26: =IF(R[-18]C="","",R[-18]C*R16C9) ->  | G26: =IF(R[-21]C="","",R[-18]C*R17C9) ->  | H26: =IF(R[-18]C="","",R[-18]C*R18C9) ->  | I26: =IF(RC[-5]="","",SUM(RC[-5]:RC[-1])) ->  | J26: =IF(RC[-1]="","",RC[-1]/R[-9]C9) -> 
A27: 5 | B27: Welches Sichtfeld bietet die Darstellung durch die Brille | C27: =R[-9]C -> Sichtfeld | D27: =IF(R[-18]C="","",R[-18]C*R14C9) ->  | E27: =IF(R[-18]C="","",R[-18]C*R15C9) ->  | F27: =IF(R[-18]C="","",R[-18]C*R16C9) ->  | G27: =IF(R[-18]C="","",R[-18]C*R17C9) ->  | H27: =IF(R[-22]C="","",R[-18]C*R18C9) ->  | I27: =IF(RC[-5]="","",SUM(RC[-5]:RC[-1])) ->  | J27: =IF(RC[-1]="","",RC[-1]/R[-9]C9) -> 
I29: count | J29: =COUNTA(R[-24]C[-7]:R[-20]C[-7]) -> 5
I30: lambda max | J30: =(SUM(R[-7]C:R[-3]C))/(COUNT(R[-7]C:R[-3]C)) -> 1
I31: CI | J31: =(R[-1]C-R[-2]C)/(R[-2]C-1) -> -1
I32: CR | J32: =R[-1]C/R[1]C -> -0.89285714285714279
I33: constant | J33: =IF(R[-4]C=R[5]C[-7],R[5]C[-6],IF(R[-4]C=R[6]C[-7],R[6]C[-6],IF(R[-4]C=R[7]C[-7],R[7]C[-6],IF(R[-4]C=R[8]C[-7],R[8]C[-6],IF(R[-4]C=R[9]C[-7],R[9]C[-6],IF(R[-4]C=R[10]C[-7],R[10]C[-6],IF(R[-4]C=R[11]C[-7],R[11]C[-6],IF(R[-4]C=R[12]C[-7],R[12]C[-6],R[13]C[-6])))))))) -> 1.1200000000000001
C35: Saaty’s CIr values for matrices are given by the following table
C36: Size of Matrix | D36: Random Consistency (CIr)
C37: 1 | D37: 0 | E37: 1
C38: 2 | D38: 0 | E38: 2
C39: 3 | D39: 0.57999999999999996 | E39: 3
C40: 4 | D40: 0.9 | E40: 4
C41: 5 | D41: 1.1200000000000001 | E41: 5
C42: 6 | D42: 1.24 | E42: 6
C43: 7 | D43: 1.32 | E43: 7
C44: 8 | D44: 1.41 | E44: 8
C45: 9 | D45: 1.45 | E45: 9
C46: 10 | D46: 1.49 | E46: 10

Sheet: GewichtungBenutzerfreundlichkei
C1: CR Value = | D1: =R[25]C[4] -> -1.7241379310344829 | F1: =IF(RC[-2]<0.1,"Reasonable Consistency","Not Consistent") -> Reasonable Consistency
C2: Pairwise comparisons
A3: Item Number | C3: Item Number | D3: 1 | E3: 2 | F3: 3 | J3: ONLY ENTER in the yellow fields
C4: Item Description | D4: =T(R[1]C[-1]) -> Inbetriebnahme | E4: =T(R[2]C[-2]) -> Bedienbarkeit | F4: =T(R[3]C[-3]) -> Dokumentation | J4: Item Descriptions can be text
A5: 1 | B5: Wie leicht fällt die erste Inbetriebnahme | C5: Inbetriebnahme | D5: 1
A6: 2 | B6: Wie leicht fällt die der Umgang bzw. die Handhabung mit der Brille | C6: Bedienbarkeit | D6: =IF(R[-1]C[1]="","",1/R[-1]C[1]) ->  | E6: 1
A7: 3 | B7: Welche Hilfestellung wird vom Hersteller bereitgestellt | C7: Dokumentation | D7: =IF(R[-2]C[2]="","",1/R[-2]C[2]) ->  | E7: =IF(R[-1]C[1]="","",1/R[-1]C[1]) ->  | F7: 1
C8: Sum | D8: =IF(R[-3]C="","",SUM(R[-3]C:R[-1]C)) -> 1 | E8: =IF(R[-3]C="","",SUM(R[-3]C:R[-1]C)) ->  | F8: =IF(R[-3]C="","",SUM(R[-3]C:R[-1]C)) -> 
C10: STANDARDIZED MATRIX
D11: =R[-7]C -> Inbetriebnahme | E11: =R[-7]C -> Bedienbarkeit | F11: =R[-7]C -> Dokumentation | G11: Weight
A12: 1 | B12: Wie leicht fällt die erste Inbetriebnahme | C12: =IF(R[-7]C="","",R[-7]C) -> Inbetriebnahme | D12: =IF(R[-7]C="","",R[-7]C/R8C4) -> 1 | E12: =IF(R[-7]C="","",R[-7]C/R8C) ->  | F12: =IF(R[-7]C="","",R[-7]C6/R8C) ->  | G12: =IF(RC[-3]="","",(SUM(RC[-3]:RC[-1])/R23C8)) -> 0.33333333333333331
A13: 2 | B13: Wie leicht fällt die der Umgang bzw. die Handhabung mit der Brille | C13: =IF(R[-7]C="","",R[-7]C) -> Bedienbarkeit | D13: =IF(R[-7]C="","",R[-7]C/R8C4) ->  | E13: =IF(R[-8]C="","",R[-7]C/R8C5) ->  | F13: =IF(R[-7]C="","",R[-7]C6/R8C) ->  | G13: =IF(RC[-3]="","",(SUM(RC[-3]:RC[-1])/R23C8)) -> 
A14: 3 | B14: Welche Hilfestellung wird vom Hersteller bereitgestellt | C14: =IF(R[-7]C="","",R[-7]C) -> Dokumentation | D14: =IF(R[-7]C="","",R[-7]C/R8C4) ->  | E14: =IF(R[-7]C="","",R[-7]C/R8C5) ->  | F14: =IF(R[-9]C="","",R[-7]C6/R8C) ->  | G14: =IF(RC[-3]="","",(SUM(RC[-3]:RC[-1])/R23C8)) -> 
C17: CI and CR worksheet
D18: =R[-7]C -> Inbetriebnahme | E18: =R[-7]C -> Bedienbarkeit | F18: =R[-7]C -> Dokumentation | G18: SUM | H18: SUM/Weight
A19: 1 | B19: Wie leicht fällt die erste Inbetriebnahme | C19: =R[-7]C -> Inbetriebnahme | D19: =IF(R[-14]C="","",R[-14]C*R12C7) -> 0.33333333333333331 | E19: =IF(R[-14]C="","",R[-14]C*R13C7) ->  | F19: =IF(R[-14]C="","",R[-14]C*R14C7) ->  | G19: =IF(RC[-3]="","",SUM(RC[-3]:RC[-1])) -> 0.33333333333333331 | H19: =IF(RC[-1]="","",RC[-1]/R[-7]C7) -> 1
A20: 2 | B20: Wie leicht fällt die der Umgang bzw. die Handhabung mit der Brille | C20: =R[-7]C -> Bedienbarkeit | D20: =IF(R[-14]C="","",R[-14]C*R12C7) ->  | E20: =IF(R[-15]C="","",R[-14]C*R13C7) ->  | F20: =IF(R[-14]C="","",R[-14]C*R14C7) ->  | G20: =IF(RC[-3]="","",SUM(RC[-3]:RC[-1])) ->  | H20: =IF(RC[-1]="","",RC[-1]/R[-7]C7) -> 
A21: 3 | B21: Welche Hilfestellung wird vom Hersteller bereitgestellt | C21: =R[-7]C -> Dokumentation | D21: =IF(R[-14]C="","",R[-14]C*R12C7) ->  | E21: =IF(R[-14]C="","",R[-14]C*R13C7) ->  | F21: =IF(R[-16]C="","",R[-14]C*R14C7) ->  | G21: =IF(RC[-3]="","",SUM(RC[-3]:RC[-1])) ->  | H21: =IF(RC[-1]="","",RC[-1]/R[-7]C7) -> 
G23: count | H23: =COUNTA(R[-18]C[-5]:R[-16]C[-5]) -> 3
G24: lambda max | H24: =(SUM(R[-5]C:R[-3]C))/(COUNT(R[-5]C:R[-3]C)) -> 1
G25: CI | H25: =(R[-1]C-R[-2]C)/(R[-2]C-1) -> -1
G26: CR | H26: =R[-1]C/R[1]C -> -1.7241379310344829
G27: constant | H27: =IF(R[-4]C=R[5]C[-5],R[5]C[-4],IF(R[-4]C=R[6]C[-5],R[6]C[-4],IF(R[-4]C=R[7]C[-5],R[7]C[-4],IF(R[-4]C=R[8]C[-5],R[8]C[-4],IF(R[-4]C=R[9]C[-5],R[9]C[-4],IF(R[-4]C=R[10]C[-5],R[10]C[-4],IF(R[-4]C=R[11]C[-5],R[11]C[-4],IF(R[-4]C=R[12]C[-5],R[12]C[-4],R[13]C[-4])))))))) -> 0.57999999999999996
C29: Saaty’s CIr values for matrices are given by the following table
C30: Size of Matrix | D30: Random Consistency (CIr)
C31: 1 | D31: 0 | E31: 1
C32: 2 | D32: 0 | E32: 2
C33: 3 | D33: 0.57999999999999996 | E33: 3
C34: 4 | D34: 0.9 | E34: 4
C35: 5 | D35: 1.1200000000000001 | E35: 5
C36: 6 | D36: 1.24 | E36: 6
C37: 7 | D37: 1.32 | E37: 7
C38: 8 | D38: 1.41 | E38: 8
C39: 9 | D39: 1.45 | E39: 9
C40: 10 | D40: 1.49 | E40: 10

Sheet: Gewichtung Gesamt
C1: CR Value = | D1: =R[44]C[10] -> -0.76628352490421459 | F1: =IF(RC[-2]<0.1,"Reasonable Consistency","Not Consistent") -> Reasonable Consistency
C2: Pairwise comparisons
A3: Item Number | C3: Item Number | D3: 1 | E3: 2 | F3: 3 | G3: 4 | H3: 5 | I3: 6 | J3: 7 | K3: 8 | L3: 9 | M3: 10 | P3: ONLY ENTER in the yellow fields
C4: Item Description | D4: =T(R[1]C[-1]) -> Kosten | E4: =T(R[2]C[-2]) -> Robustheit | F4: =T(R[3]C[-3]) -> Tragekomfort | G4: =T(R[4]C[-4]) -> Qualität der Immersion | H4: =T(R[5]C[-5]) -> Benutzerfreundlichkeit | I4: =T(R[6]C[-6]) -> Mobilität des Systems | J4: =T(R[7]C[-7]) -> Open Source Software | K4: =T(R[8]C[-8]) -> Open Hardware | L4: =T(R[9]C[-9]) -> Verfügbare Software | M4: =T(R[10]C[-10]) -> Entwicklung für diese Plattform | P4: Item Descriptions can be text
A5: 1 | B5: Anschaffung als auch evtl. laufende Kosten | C5: Kosten | D5: 1
A6: 2 | B6: Langlebigkeit der Brille | C6: Robustheit | D6: =IF(R[-1]C[1]="","",1/R[-1]C[1]) ->  | E6: 1
A7: 3 | B7: siehe Unterkriterien | C7: Tragekomfort | D7: =IF(R[-2]C[2]="","",1/R[-2]C[2]) ->  | E7: =IF(R[-1]C[1]="","",1/R[-1]C[1]) ->  | F7: 1
A8: 4 | B8: siehe Unterkriterien | C8: Qualität der Immersion | D8: =IF(R[-3]C[3]="","",1/R[-3]C[3]) ->  | E8: =IF(R[-2]C[2]="","",1/R[-2]C[2]) ->  | F8: =IF(R[-1]C[1]="","",1/R[-1]C[1]) ->  | G8: 1
A9: 5 | B9: siehe Unterkriterien | C9: Benutzerfreundlichkeit | D9: =IF(R[-4]C[4]="","",1/R[-4]C[4]) ->  | E9: =IF(R[-3]C[3]="","",1/R[-3]C[3]) ->  | F9: =IF(R[-2]C[2]="","",1/R[-2]C[2]) ->  | G9: =IF(R[-1]C[1]="","",1/R[-1]C[1]) ->  | H9: 1
A10: 6 | B10: Ist ein PC nötig? Wird die Bewegungsfreiheit durch Kabel eingeschränkt? | C10: Mobilität des Systems | D10: =IF(R[-5]C[5]="","",1/R[-5]C[5]) ->  | E10: =IF(R[-4]C[4]="","",1/R[-4]C[4]) ->  | F10: =IF(R[-3]C[3]="","",1/R[-3]C[3]) ->  | G10: =IF(R[-2]C[2]="","",1/R[-2]C[2]) ->  | H10: =IF(R[-1]C[1]="","",1/R[-1]C[1]) ->  | I10: 1
A11: 7 | B11: Ist der Software Code öffentlich zugänglich? | C11: Open Source Software | D11: =IF(R[-6]C[6]="","",1/R[-6]C[6]) ->  | E11: =IF(R[-5]C[5]="","",1/R[-5]C[5]) ->  | F11: =IF(R[-4]C[4]="","",1/R[-4]C[4]) ->  | G11: =IF(R[-3]C[3]="","",1/R[-3]C[3]) ->  | H11: =IF(R[-2]C[2]="","",1/R[-2]C[2]) ->  | I11: =IF(R[-1]C[1]="","",1/R[-1]C[1]) ->  | J11: 1
A12: 8 | B12: Werden die verwendeten, technischen Komponenten vom Hersteller offgelegt? | C12: Open Hardware | D12: =IF(R[-7]C[7]="","",1/R[-7]C[7]) ->  | E12: =IF(R[-6]C[6]="","",1/R[-6]C[6]) ->  | F12: =IF(R[-5]C[5]="","",1/R[-5]C[5]) ->  | G12: =IF(R[-4]C[4]="","",1/R[-4]C[4]) ->  | H12: =IF(R[-3]C[3]="","",1/R[-3]C[3]) ->  | I12: =IF(R[-2]C[2]="","",1/R[-2]C[2]) ->  | J12: =IF(R[-1]C[1]="","",1/R[-1]C[1]) ->  | K12: 1
A13: 9 | B13: Anzahl und Art | C13: Verfügbare Software | D13: =IF(R[-8]C[8]="","",1/R[-8]C[8]) ->  | E13: =IF(R[-7]C[7]="","",1/R[-7]C[7]) ->  | F13: =IF(R[-6]C[6]="","",1/R[-6]C[6]) ->  | G13: =IF(R[-5]C[5]="","",1/R[-5]C[5]) ->  | H13: =IF(R[-4]C[4]="","",1/R[-4]C[4]) ->  | I13: =IF(R[-3]C[3]="","",1/R[-3]C[3]) ->  | J13: =IF(R[-2]C[2]="","",1/R[-2]C[2]) ->  | K13: =IF(R[-1]C[1]="","",1/R[-1]C[1]) ->  | L13: 1
A14: 10 | B14: Wie leicht ist eine native Entwicklung möglich? | C14: Entwicklung für diese Plattform | D14: =IF(R[-9]C[9]="","",1/R[-9]C[9]) ->  | E14: =IF(R[-8]C[8]="","",1/R[-8]C[8]) ->  | F14: =IF(R[-7]C[7]="","",1/R[-7]C[7]) ->  | G14: =IF(R[-6]C[6]="","",1/R[-6]C[6]) ->  | H14: =IF(R[-5]C[5]="","",1/R[-5]C[5]) ->  | I14: =IF(R[-4]C[4]="","",1/R[-4]C[4]) ->  | J14: =IF(R[-3]C[3]="","",1/R[-3]C[3]) ->  | K14: =IF(R[-2]C[2]="","",1/R[-2]C[2]) ->  | L14: =IF(R[-1]C[1]="","",1/R[-1]C[1]) ->  | M14: 1
C15: Sum | D15: =IF(R[-10]C="","",SUM(R[-10]C:R[-1]C)) -> 1 | E15: =IF(R[-10]C="","",SUM(R[-10]C:R[-1]C)) ->  | F15: =IF(R[-10]C="","",SUM(R[-10]C:R[-1]C)) ->  | G15: =IF(R[-10]C="","",SUM(R[-10]C:R[-1]C)) ->  | H15: =IF(R[-10]C="","",SUM(R[-10]C:R[-1]C)) ->  | I15: =IF(R[-10]C="","",SUM(R[-10]C:R[-1]C)) ->  | J15: =IF(R[-10]C="","",SUM(R[-10]C:R[-1]C)) ->  | K15: =IF(R[-10]C="","",SUM(R[-10]C:R[-1]C)) ->  | L15: =IF(R[-10]C="","",SUM(R[-10]C:R[-1]C)) ->  | M15: =IF(R[-10]C="","",SUM(R[-10]C:R[-1]C)) -> 
C17: STANDARDIZED MATRIX
D18: =R[-14]C -> Kosten | E18: =R[-14]C -> Robustheit | F18: =R[-14]C -> Tragekomfort | G18: =R[-14]C -> Qualität der Immersion | H18: =R[-14]C -> Benutzerfreundlichkeit | I18: =R[-14]C -> Mobilität des Systems | J18: =R[-14]C -> Open Source Software | K18: =R[-14]C -> Open Hardware | L18: =R[-14]C -> Verfügbare Software | M18: =R[-14]C -> Entwicklung für diese Plattform | N18: Weight
A19: 1 | B19: Anschaffung als auch evtl. laufende Kosten | C19: =IF(R[-14]C="","",R[-14]C) -> Kosten | D19: =IF(R[-14]C="","",R[-14]C/R15C4) -> 1 | E19: =IF(R[-14]C="","",R[-14]C/R15C) ->  | F19: =IF(R[-14]C="","",R[-14]C6/R15C) ->  | G19: =IF(R[-14]C="","",R[-14]C7/R15C) ->  | H19: =IF(R[-14]C="","",R[-14]C8/R15C) ->  | I19: =IF(R[-14]C="","",R[-14]C9/R15C) ->  | J19: =IF(R[-14]C="","",R[-14]C10/R15C) ->  | K19: =IF(R[-14]C="","",R[-14]C11/R15C) ->  | L19: =IF(R[-14]C="","",R[-14]C12/R15C) ->  | M19: =IF(R[-14]C="","",R[-14]C13/R15C) ->  | N19: =IF(RC[-10]="","",(SUM(RC[-10]:RC[-1])/R42C14)) -> 0.1111111111111111
A20: 2 | B20: Langlebigkeit der Brille | C20: =IF(R[-14]C="","",R[-14]C) -> Robustheit | D20: =IF(R[-14]C="","",R[-14]C/R15C4) ->  | E20: =IF(R[-15]C="","",R[-14]C/R15C5) ->  | F20: =IF(R[-14]C="","",R[-14]C6/R15C) ->  | G20: =IF(R[-14]C="","",R[-14]C7/R15C) ->  | H20: =IF(R[-14]C="","",R[-14]C8/R15C) ->  | I20: =IF(R[-14]C="","",R[-14]C9/R15C) ->  | J20: =IF(R[-14]C="","",R[-14]C10/R15C) ->  | K20: =IF(R[-14]C="","",R[-14]C11/R15C) ->  | L20: =IF(R[-14]C="","",R[-14]C12/R15C) ->  | M20: =IF(R[-14]C="","",R[-14]C13/R15C) ->  | N20: =IF(RC[-10]="","",(SUM(RC[-10]:RC[-1])/R42C14)) -> 
A21: 3 | B21: siehe Unterkriterien | C21: =IF(R[-14]C="","",R[-14]C) -> Tragekomfort | D21: =IF(R[-14]C="","",R[-14]C/R15C4) ->  | E21: =IF(R[-14]C="","",R[-14]C/R15C5) ->  | F21: =IF(R[-16]C="","",R[-14]C6/R15C) ->  | G21: =IF(R[-14]C="","",R[-14]C7/R15C) ->  | H21: =IF(R[-14]C="","",R[-14]C8/R15C) ->  | I21: =IF(R[-14]C="","",R[-14]C9/R15C) ->  | J21: =IF(R[-14]C="","",R[-14]C10/R15C) ->  | K21: =IF(R[-14]C="","",R[-14]C11/R15C) ->  | L21: =IF(R[-14]C="","",R[-14]C12/R15C) ->  | M21: =IF(R[-14]C="","",R[-14]C13/R15C) ->  | N21: =IF(RC[-10]="","",(SUM(RC[-10]:RC[-1])/R42C14)) -> 
A22: 4 | B22: siehe Unterkriterien | C22: =IF(R[-14]C="","",R[-14]C) -> Qualität der Immersion | D22: =IF(R[-14]C="","",R[-14]C/R15C4) ->  | E22: =IF(R[-14]C="","",R[-14]C/R15C5) ->  | F22: =IF(R[-14]C="","",R[-14]C6/R15C) ->  | G22: =IF(R[-17]C="","",R[-14]C7/R15C) ->  | H22: =IF(R[-14]C="","",R[-14]C8/R15C) ->  | I22: =IF(R[-14]C="","",R[-14]C9/R15C) ->  | J22: =IF(R[-14]C="","",R[-14]C10/R15C) ->  | K22: =IF(R[-14]C="","",R[-14]C11/R15C) ->  | L22: =IF(R[-14]C="","",R[-14]C12/R15C) ->  | M22: =IF(R[-14]C="","",R[-14]C13/R15C) ->  | N22: =IF(RC[-10]="","",(SUM(RC[-10]:RC[-1])/R42C14)) -> 
A23: 5 | B23: siehe Unterkriterien | C23: =IF(R[-14]C="","",R[-14]C) -> Benutzerfreundlichkeit | D23: =IF(R[-14]C="","",R[-14]C/R15C4) ->  | E23: =IF(R[-14]C="","",R[-14]C/R15C5) ->  | F23: =IF(R[-14]C="","",R[-14]C6/R15C) ->  | G23: =IF(R[-14]C="","",R[-14]C7/R15C) ->  | H23: =IF(R[-18]C="","",R[-14]C8/R15C) ->  | I23: =IF(R[-14]C="","",R[-14]C9/R15C) ->  | J23: =IF(R[-14]C="","",R[-14]C10/R15C) ->  | K23: =IF(R[-14]C="","",R[-14]C11/R15C) ->  | L23: =IF(R[-14]C="","",R[-14]C12/R15C) ->  | M23: =IF(R[-14]C="","",R[-14]C13/R15C) ->  | N23: =IF(RC[-10]="","",(SUM(RC[-10]:RC[-1])/R42C14)) -> 
A24: 7 | B24: Ist ein PC nötig? Wird die Bewegungsfreiheit durch Kabel eingeschränkt? | C24: =IF(R[-14]C="","",R[-14]C) -> Mobilität des Systems | D24: =IF(R[-14]C="","",R[-14]C/R15C4) ->  | E24: =IF(R[-14]C="","",R[-14]C/R15C5) ->  | F24: =IF(R[-14]C="","",R[-14]C6/R15C) ->  | G24: =IF(R[-14]C="","",R[-14]C7/R15C) ->  | H24: =IF(R[-14]C="","",R[-14]C8/R15C) ->  | I24: =IF(R[-19]C="","",R[-14]C9/R15C) ->  | J24: =IF(R[-14]C="","",R[-14]C10/R15C) ->  | K24: =IF(R[-14]C="","",R[-14]C11/R15C) ->  | L24: =IF(R[-14]C="","",R[-14]C12/R15C) ->  | M24: =IF(R[-14]C="","",R[-14]C13/R15C) ->  | N24: =IF(RC[-10]="","",(SUM(RC[-10]:RC[-1])/R42C14)) -> 
A25: 8 | B25: Ist der Software Code öffentlich zugänglich? | C25: =IF(R[-14]C="","",R[-14]C) -> Open Source Software | D25: =IF(R[-14]C="","",R[-14]C/R15C4) ->  | E25: =IF(R[-14]C="","",R[-14]C/R15C5) ->  | F25: =IF(R[-14]C="","",R[-14]C6/R15C) ->  | G25: =IF(R[-14]C="","",R[-14]C7/R15C) ->  | H25: =IF(R[-14]C="","",R[-14]C8/R15C) ->  | I25: =IF(R[-14]C="","",R[-14]C9/R15C) ->  | J25: =IF(R[-20]C="","",R[-14]C10/R15C) ->  | K25: =IF(R[-14]C="","",R[-14]C11/R15C) ->  | L25: =IF(R[-14]C="","",R[-14]C12/R15C) ->  | M25: =IF(R[-14]C="","",R[-14]C13/R15C) ->  | N25: =IF(RC[-10]="","",(SUM(RC[-10]:RC[-1])/R42C14)) -> 
A26: 9 | B26: Werden die verwendeten, technischen Komponenten vom Hersteller offgelegt? | C26: =IF(R[-14]C="","",R[-14]C) -> Open Hardware | D26: =IF(R[-14]C="","",R[-14]C/R15C4) ->  | E26: =IF(R[-14]C="","",R[-14]C/R15C5) ->  | F26: =IF(R[-14]C="","",R[-14]C6/R15C) ->  | G26: =IF(R[-14]C="","",R[-14]C7/R15C) ->  | H26: =IF(R[-14]C="","",R[-14]C8/R15C) ->  | I26: =IF(R[-14]C="","",R[-14]C9/R15C) ->  | J26: =IF(R[-14]C="","",R[-14]C10/R15C) ->  | K26: =IF(R[-21]C="","",R[-14]C11/R15C) ->  | L26: =IF(R[-14]C="","",R[-14]C12/R15C) ->  | M26: =IF(R[-14]C="","",R[-14]C13/R15C) ->  | N26: =IF(RC[-10]="","",(SUM(RC[-10]:RC[-1])/R42C14)) -> 
A27: 10 | B27: Anzahl und Art | C27: =IF(R[-14]C="","",R[-14]C) -> Verfügbare Software | D27: =IF(R[-14]C="","",R[-14]C/R15C4) ->  | E27: =IF(R[-14]C="","",R[-14]C/R15C5) ->  | F27: =IF(R[-14]C="","",R[-14]C6/R15C) ->  | G27: =IF(R[-14]C="","",R[-14]C7/R15C) ->  | H27: =IF(R[-14]C="","",R[-14]C8/R15C) ->  | I27: =IF(R[-14]C="","",R[-14]C9/R15C) ->  | J27: =IF(R[-14]C="","",R[-14]C10/R15C) ->  | K27: =IF(R[-14]C="","",R[-14]C11/R15C) ->  | L27: =IF(R[-22]C="","",R[-14]C12/R15C) ->  | M27: =IF(R[-14]C="","",R[-14]C13/R15C) ->  | N27: =IF(RC[-10]="","",(SUM(RC[-10]:RC[-1])/R42C14)) -> 
A28: 11 | B28: Wie leicht ist eine native Entwicklung möglich? | C28: =IF(R[-14]C="","",R[-14]C) -> Entwicklung für diese Plattform | D28: =IF(R[-14]C="","",R[-14]C/R15C4) ->  | E28: =IF(R[-14]C="","",R[-14]C/R15C5) ->  | F28: =IF(R[-14]C="","",R[-14]C6/R15C) ->  | G28: =IF(R[-14]C="","",R[-14]C7/R15C) ->  | H28: =IF(R[-14]C="","",R[-14]C8/R15C) ->  | I28: =IF(R[-14]C="","",R[-14]C9/R15C) ->  | J28: =IF(R[-14]C="","",R[-14]C10/R15C) ->  | K28: =IF(R[-14]C="","",R[-14]C11/R15C) ->  | L28: =IF(R[-22]C="","",R[-14]C12/R15C) ->  | M28: =IF(R[-14]C="","",R[-14]C13/R15C) -> #VALUE! | N28: =IF(RC[-10]="","",(SUM(RC[-10]:RC[-1])/R42C14)) -> 
C30: CI and CR worksheet
D31: =R[-13]C -> Kosten | E31: =R[-13]C -> Robustheit | F31: =R[-13]C -> Tragekomfort | G31: =R[-13]C -> Qualität der Immersion | H31: =R[-13]C -> Benutzerfreundlichkeit | I31: =R[-13]C -> Mobilität des Systems | J31: =R[-13]C -> Open Source Software | K31: =R[-13]C -> Open Hardware | L31: =R[-13]C -> Verfügbare Software | M31: =R[-13]C -> Entwicklung für diese Plattform | N31: SUM | O31: SUM/Weight
A32: 1 | B32: Anschaffung als auch evtl. laufende Kosten | C32: =R[-13]C -> Kosten | D32: =IF(R[-27]C="","",R[-27]C*R19C14) -> 0.1111111111111111 | E32: =IF(R[-27]C="","",R[-27]C*R20C14) ->  | F32: =IF(R[-27]C="","",R[-27]C*R21C14) ->  | G32: =IF(R[-27]C="","",R[-27]C*R22C14) ->  | H32: =IF(R[-27]C="","",R[-27]C*R23C14) ->  | I32: =IF(R[-27]C="","",R[-27]C*R24C14) ->  | J32: =IF(R[-27]C="","",R[-27]C*R25C14) ->  | K32: =IF(R[-27]C="","",R[-27]C*R26C14) ->  | L32: =IF(R[-27]C="","",R[-27]C*R27C14) ->  | M32: =IF(R[-27]C="","",R[-27]C*R28C14) ->  | N32: =IF(RC[-10]="","",SUM(RC[-10]:RC[-1])) -> 0.1111111111111111 | O32: =IF(RC[-1]="","",RC[-1]/R[-13]C14) -> 1
A33: 2 | B33: Langlebigkeit der Brille | C33: =R[-13]C -> Robustheit | D33: =IF(R[-27]C="","",R[-27]C*R19C14) ->  | E33: =IF(R[-28]C="","",R[-27]C*R20C14) ->  | F33: =IF(R[-27]C="","",R[-27]C*R21C14) ->  | G33: =IF(R[-27]C="","",R[-27]C*R22C14) ->  | H33: =IF(R[-27]C="","",R[-27]C*R23C14) ->  | I33: =IF(R[-27]C="","",R[-27]C*R24C14) ->  | J33: =IF(R[-27]C="","",R[-27]C*R25C14) ->  | K33: =IF(R[-27]C="","",R[-27]C*R26C14) ->  | L33: =IF(R[-27]C="","",R[-27]C*R27C14) ->  | M33: =IF(R[-27]C="","",R[-27]C*R28C14) ->  | N33: =IF(RC[-10]="","",SUM(RC[-10]:RC[-1])) ->  | O33: =IF(RC[-1]="","",RC[-1]/R[-13]C14) -> 
A34: 3 | B34: siehe Unterkriterien | C34: =R[-13]C -> Tragekomfort | D34: =IF(R[-27]C="","",R[-27]C*R19C14) ->  | E34: =IF(R[-27]C="","",R[-27]C*R20C14) ->  | F34: =IF(R[-27]C="","",R[-27]C*R21C14) -> #VALUE! | G34: =IF(R[-27]C="","",R[-27]C*R22C14) ->  | H34: =IF(R[-27]C="","",R[-27]C*R23C14) ->  | I34: =IF(R[-27]C="","",R[-27]C*R24C14) ->  | J34: =IF(R[-27]C="","",R[-27]C*R25C14) ->  | K34: =IF(R[-27]C="","",R[-27]C*R26C14) ->  | L34: =IF(R[-27]C="","",R[-27]C*R27C14) ->  | M34: =IF(R[-27]C="","",R[-27]C*R28C14) ->  | N34: =IF(RC[-10]="","",SUM(RC[-10]:RC[-1])) ->  | O34: =IF(RC[-1]="","",RC[-1]/R[-13]C14) -> 
A35: 4 | B35: siehe Unterkriterien | C35: =R[-13]C -> Qualität der Immersion | D35: =IF(R[-27]C="","",R[-27]C*R19C14) ->  | E35: =IF(R[-28]C="","",R[-27]C*R20C14) ->  | F35: =IF(R[-27]C="","",R[-27]C*R21C14) ->  | G35: =IF(R[-27]C="","",R[-27]C*R22C14) -> #VALUE! | H35: =IF(R[-27]C="","",R[-27]C*R23C14) ->  | I35: =IF(R[-27]C="","",R[-27]C*R24C14) ->  | J35: =IF(R[-27]C="","",R[-27]C*R25C14) ->  | K35: =IF(R[-27]C="","",R[-27]C*R26C14) ->  | L35: =IF(R[-27]C="","",R[-27]C*R27C14) ->  | M35: =IF(R[-27]C="","",R[-27]C*R28C14) ->  | N35: =IF(RC[-10]="","",SUM(RC[-10]:RC[-1])) ->  | O35: =IF(RC[-1]="","",RC[-1]/R[-13]C14) -> 
A36: 5 | B36: siehe Unterkriterien | C36: =R[-13]C -> Benutzerfreundlichkeit | D36: =IF(R[-27]C="","",R[-27]C*R19C14) ->  | E36: =IF(R[-27]C="","",R[-27]C*R20C14) ->  | F36: =IF(R[-27]C="","",R[-27]C*R21C14) ->  | G36: =IF(R[-27]C="","",R[-27]C*R22C14) ->  | H36: =IF(R[-27]C="","",R[-27]C*R23C14) -> #VALUE! | I36: =IF(R[-27]C="","",R[-27]C*R24C14) ->  | J36: =IF(R[-27]C="","",R[-27]C*R25C14) ->  | K36: =IF(R[-27]C="","",R[-27]C*R26C14) ->  | L36: =IF(R[-27]C="","",R[-27]C*R27C14) ->  | M36: =IF(R[-27]C="","",R[-27]C*R28C14) ->  | N36: =IF(RC[-10]="","",SUM(RC[-10]:RC[-1])) ->  | O36: =IF(RC[-1]="","",RC[-1]/R[-13]C14) -> 
A37: 7 | B37: Ist ein PC nötig? Wird die Bewegungsfreiheit durch Kabel eingeschränkt? | C37: =R[-13]C -> Mobilität des Systems | D37: =IF(R[-27]C="","",R[-27]C*R19C14) ->  | E37: =IF(R[-27]C="","",R[-27]C*R20C14) ->  | F37: =IF(R[-27]C="","",R[-27]C*R21C14) ->  | G37: =IF(R[-27]C="","",R[-27]C*R22C14) ->  | H37: =IF(R[-27]C="","",R[-27]C*R23C14) ->  | I37: =IF(R[-27]C="","",R[-27]C*R24C14) -> #VALUE! | J37: =IF(R[-27]C="","",R[-27]C*R25C14) ->  | K37: =IF(R[-27]C="","",R[-27]C*R26C14) ->  | L37: =IF(R[-27]C="","",R[-27]C*R27C14) ->  | M37: =IF(R[-27]C="","",R[-27]C*R28C14) ->  | N37: =IF(RC[-10]="","",SUM(RC[-10]:RC[-1])) ->  | O37: =IF(RC[-1]="","",RC[-1]/R[-13]C14) -> 
A38: 8 | B38: Ist der Software Code öffentlich zugänglich? | C38: =R[-13]C -> Open Source Software | D38: =IF(R[-27]C="","",R[-27]C*R19C14) ->  | E38: =IF(R[-28]C="","",R[-27]C*R20C14) ->  | F38: =IF(R[-27]C="","",R[-27]C*R21C14) ->  | G38: =IF(R[-27]C="","",R[-27]C*R22C14) ->  | H38: =IF(R[-27]C="","",R[-27]C*R23C14) ->  | I38: =IF(R[-27]C="","",R[-27]C*R24C14) ->  | J38: =IF(R[-27]C="","",R[-27]C*R25C14) -> #VALUE! | K38: =IF(R[-27]C="","",R[-27]C*R26C14) ->  | L38: =IF(R[-27]C="","",R[-27]C*R27C14) ->  | M38: =IF(R[-27]C="","",R[-27]C*R28C14) ->  | N38: =IF(RC[-10]="","",SUM(RC[-10]:RC[-1])) ->  | O38: =IF(RC[-1]="","",RC[-1]/R[-13]C14) -> 
A39: 9 | B39: Werden die verwendeten, technischen Komponenten vom Hersteller offgelegt? | C39: =R[-13]C -> Open Hardware | D39: =IF(R[-27]C="","",R[-27]C*R19C14) ->  | E39: =IF(R[-27]C="","",R[-27]C*R20C14) ->  | F39: =IF(R[-27]C="","",R[-27]C*R21C14) ->  | G39: =IF(R[-27]C="","",R[-27]C*R22C14) ->  | H39: =IF(R[-27]C="","",R[-27]C*R23C14) ->  | I39: =IF(R[-27]C="","",R[-27]C*R24C14) ->  | J39: =IF(R[-27]C="","",R[-27]C*R25C14) ->  | K39: =IF(R[-27]C="","",R[-27]C*R26C14) -> #VALUE! | L39: =IF(R[-27]C="","",R[-27]C*R27C14) ->  | M39: =IF(R[-27]C="","",R[-27]C*R28C14) ->  | N39: =IF(RC[-10]="","",SUM(RC[-10]:RC[-1])) ->  | O39: =IF(RC[-1]="","",RC[-1]/R[-13]C14) -> 
A40: 10 | B40: Anzahl und Art | C40: =R[-13]C -> Verfügbare Software | D40: =IF(R[-27]C="","",R[-27]C*R19C14) ->  | E40: =IF(R[-28]C="","",R[-27]C*R20C14) ->  | F40: =IF(R[-27]C="","",R[-27]C*R21C14) ->  | G40: =IF(R[-27]C="","",R[-27]C*R22C14) ->  | H40: =IF(R[-27]C="","",R[-27]C*R23C14) ->  | I40: =IF(R[-27]C="","",R[-27]C*R24C14) ->  | J40: =IF(R[-27]C="","",R[-27]C*R25C14) ->  | K40: =IF(R[-27]C="","",R[-27]C*R26C14) ->  | L40: =IF(R[-27]C="","",R[-27]C*R27C14) -> #VALUE! | M40: =IF(R[-27]C="","",R[-27]C*R28C14) ->  | N40: =IF(RC[-10]="","",SUM(RC[-10]:RC[-1])) ->  | O40: =IF(RC[-1]="","",RC[-1]/R[-13]C14) -> 
A41: 11 | B41: Wie leicht ist eine native Entwicklung möglich? | C41: =R[-13]C -> Entwicklung für diese Plattform | D41: =IF(R[-27]C="","",R[-27]C*R19C14) ->  | E41: =IF(R[-27]C="","",R[-27]C*R20C14) ->  | F41: =IF(R[-27]C="","",R[-27]C*R21C14) ->  | G41: =IF(R[-27]C="","",R[-27]C*R22C14) ->  | H41: =IF(R[-27]C="","",R[-27]C*R23C14) ->  | I41: =IF(R[-27]C="","",R[-27]C*R24C14) ->  | J41: =IF(R[-27]C="","",R[-27]C*R25C14) ->  | K41: =IF(R[-27]C="","",R[-27]C*R26C14) ->  | L41: =IF(R[-27]C="","",R[-27]C*R27C14) ->  | M41: =IF(R[-27]C="","",R[-27]C*R28C14) -> #VALUE! | N41: =IF(RC[-10]="","",SUM(RC[-10]:RC[-1])) ->  | O41: =IF(RC[-1]="","",RC[-1]/R[-13]C14) -> 
M42: count | N42: =COUNTA(R[-37]C[-11]:R[-29]C[-11]) -> 9
M43: lambda max | N43: =(SUM(R[-11]C:R[-3]C))/(COUNT(R[-11]C:R[-3]C)) -> 0.1111111111111111
M44: CI | N44: =(R[-1]C-R[-2]C)/(R[-2]C-1) -> -1.1111111111111112
M45: CR | N45: =R[-1]C/R[1]C -> -0.76628352490421459
M46: constant | N46: =IF(R[-4]C=R[5]C[-11],R[5]C[-10],IF(R[-4]C=R[6]C[-11],R[6]C[-10],IF(R[-4]C=R[7]C[-11],R[7]C[-10],IF(R[-4]C=R[8]C[-11],R[8]C[-10],IF(R[-4]C=R[9]C[-11],R[9]C[-10],IF(R[-4]C=R[10]C[-11],R[10]C[-10],IF(R[-4]C=R[11]C[-11],R[11]C[-10],IF(R[-4]C=R[12]C[-11],R[12]C[-10],R[13]C[-10])))))))) -> 1.45
C48: Saaty’s CIr values for matrices are given by the following table
C49: Size of Matrix | D49: Random Consistency (CIr)
C50: 1 | D50: 0 | E50: 1
C51: 2 | D51: 0 | E51: 2
C52: 3 | D52: 0.57999999999999996 | E52: 3
C53: 4 | D53: 0.9 | E53: 4
C54: 5 | D54: 1.1200000000000001 | E54: 5
C55: 6 | D55: 1.24 | E55: 6
C56: 7 | D56: 1.32 | E56: 7
C57: 8 | D57: 1.41 | E57: 8
C58: 9 | D58: 1.45 | E58: 9
C59: 10 | D59: 1.49 | E59: 10