Sheet: Anleitung
A1: 1. Füllen Sie nur die gelben Felder aus
A2: 2. Verwenden Sie die rechststehende Skala (Englische Anleitung ausführlicher als Deutsche)
A3: 3. Wählen Sie eine gelbe Zelle aus und Vergleichen Sie das Kriterium aus der anliegende Zeile mit dem Kriterium aus der anliegenden Spalte
A4: 4. Tragen Sie einen Wert aus der Skala in die Zelle ein, welcher Ihren Präferenzen entspricht
A5: 5. Wiederholen Sie die Schritte bis alle gelben Felder ausgefühllt sind
A16: Beispiel:
A18: Item Number | B18: Item Number | C18: 1 | D18: 2 | E18: 3
B19: Item Description | C19: =T(R[1]C[-1]) -> Menge der Apps | D19: =T(R[2]C[-2]) -> Entwicklungsumgebung | E19: =T(R[3]C[-3]) -> Unterstütze Beriebssysteme
A20: 1 | B20: Menge der Apps | C20: 1 | D20: 7 | E20: 8
A21: 2 | B21: Entwicklungsumgebung | C21: =IF(R[-1]C[1]="","",1/R[-1]C[1]) -> 0.14285714285714285 | D21: 1 | E21: 1
A22: 3 | B22: Unterstütze Beriebssysteme | C22: =IF(R[-2]C[2]="","",1/R[-2]C[2]) -> 0.125 | D22: =IF(R[-1]C[1]="","",1/R[-1]C[1]) -> 1 | E22: 1
A23: 5 | B23: Sum | C23: =IF(R[-3]C="","",SUM(R[-3]C:R[-1]C)) -> 1.2678571428571428 | D23: =IF(R[-3]C="","",SUM(R[-3]C:R[-1]C)) -> 9 | E23: =IF(R[-3]C="","",SUM(R[-3]C:R[-1]C)) -> 10
H27: Rating Scale
H30: Rating | I30: Definition
H31: 9 | I31: Row extremely more important
H32: 8 | I32: Row very strongly to extremely more important
H33: 7 | I33: Row very strongly more important
H34: 6 | I34: Row strongly to very strongly more important
H35: 5 | I35: Row strongly more important
H36: 4 | I36: Row moderately to strongly more important
H37: 3 | I37: Row moderately more important
H38: 2 | I38: Row equally important to moderately more important
H39: 1 | I39: Row and column equally important
H40: 1/2 | I40: Column equally important to moderately more important
H41: 1/3 | I41: Column moderately more important
H42: 1/4 | I42: Column moderately to strongly more important
H43: 1/5 | I43: Column strongly more important
H44: 1/6 | I44: Column strongly to very strongly more important
H45: 1/7 | I45: Column very strongly more important
H46: 1/8 | I46: Column very strongly to extremely more important
H47: 1/9 | I47: Column extremely more important

Sheet: Zusammenfassung
D6: Gewicht | E6: Polsterung | F6: Weight
A7: 1 | B7: Gewicht der Brille | C7: Gewicht | D7: 0.8 | E7: 0.8 | F7: 0.8
A8: 2 | B8: Wie bequem ist die Polsterung? | C8: Polsterung | D8: 0.2 | E8: 0.2 | F8: 0.2
D14: Displayauflösung | E14: Qualität der Texturen | F14: Präzession des Trackings | G14: FPS | H14: Sichtfeld | I14: Weight
A15: 1 | C15: Displayauflösung | D15: 9.0906611389919262E-2 | E15: 9.0906611389919262E-2 | F15: 0.15383550263085019 | G15: 4.4334975369458129E-2 | H15: 5.5555555555555552E-2 | I15: 8.7107851267140463E-2
A16: 2 | B16: Wie aufwändig ist die Grafik der Simulation | C16: Qualität der Texturen | D16: 9.0906611389919262E-2 | E16: 9.0906611389919262E-2 | F16: 0.15383550263085019 | G16: 4.4334975369458129E-2 | H16: 5.5555555555555552E-2 | I16: 8.7107851267140463E-2
A17: 3 | B17: Wie präzise kann die Simulation meinen Kopfbewegungen folgen | C17: Präzession des Trackings | D17: 0.27274710888064585 | E17: 0.27274710888064585 | F17: 0.46155266315886645 | G17: 0.66502463054187189 | H17: 0.33333333333333331 | I17: 0.40108096895907269
A18: 4 | B18: Bilder pro Sekunde | C18: FPS | D18: 0.45453305694959634 | E18: 0.45453305694959634 | F18: 0.15385088771962213 | G18: 0.22167487684729065 | H18: 0.5 | I18: 0.3569183756932211
A19: 5 | B19: Welches Sichtfeld bietet die Darstellung durch die Brille | C19: Sichtfeld | D19: 9.0906611389919262E-2 | E19: 9.0906611389919262E-2 | F19: 7.6925443859811066E-2 | G19: 2.463054187192118E-2 | H19: 5.5555555555555552E-2 | I19: 6.7784952813425267E-2
D26: Inbetriebnahme | E26: Bedienbarkeit | F26: Dokumentation | G26: Weight
A27: 1 | B27: Wie leicht fällt die erste Inbetriebnahme | C27: Inbetriebnahme | D27: 0.11110740716047736 | E27: 6.2494140588378683E-2 | F27: 0.13793103448275862 | G27: 0.1038441940772049
A28: 2 | B28: Wie leicht fällt die der Umgang bzw. die Handhabung mit der Brille | C28: Bedienbarkeit | D28: 0.33335555703713582 | E28: 0.18750117188232429 | F28: 0.17241379310344829 | G28: 0.23109017400763612
A29: 3 | B29: Welche Hilfestellung wird vom Hersteller bereitgestellt | C29: Dokumentation | D29: 0.55553703580238678 | E29: 0.75000468752929716 | F29: 0.68965517241379315 | G29: 0.66506563191515899
D37: Kosten | E37: Robustheit | F37: Tragekomfort | G37: Qualität der Immersion | H37: Benutzerfreundlichkeit | I37: Mobilität des Systems | J37: Open Source Software | K37: Open Hardware | L37: Verfügbare Software | M37: Entwicklung für diese Plattform | N37: Weight
A38: 1 | B38: Anschaffung als auch evtl. laufende Kosten | C38: Kosten | D38: 0.11087645195353749 | E38: 0.14337733272644512 | F38: 0.15813253012048192 | G38: 0.17008639308855289 | H38: 8.2191780821917818E-2 | I38: 0.10769031936450203 | J38: 0.09 | K38: 0.13976738048973825 | L38: 0.11125848445281887 | M38: 0.33546325878594252 | N38: 0.1609826590893263
A39: 2 | B39: Langlebigkeit der Brille | C39: Robustheit | D39: 0.11087645195353749 | E39: 0.14337733272644512 | F39: 0.15813253012048192 | G39: 0.17008639308855289 | H39: 8.2191780821917818E-2 | I39: 0.10769031936450203 | J39: 0.09 | K39: 0.13976738048973825 | L39: 0.13907310556602359 | M39: 0.33546325878594252 | N39: 0.16407317254634907
A40: 3 | B40: siehe Unterkriterien | C40: Tragekomfort | D40: 2.2175290390707498E-2 | E40: 2.8675466545289029E-2 | F40: 3.1626506024096383E-2 | G40: 1.8898488120950321E-2 | H40: 6.164383561643836E-2 | I40: 4.6152994013358012E-2 | J40: 7.0000000000000007E-2 | K40: 6.9883690244869123E-2 | L40: 5.5629242226409435E-2 | M40: 4.7923322683706075E-2 | N40: 5.0289870651758245E-2
A41: 4 | B41: siehe Unterkriterien | C41: Qualität der Immersion | D41: 3.6958817317845824E-2 | E41: 4.7792444242148374E-2 | F41: 9.4879518072289157E-2 | G41: 5.6695464362850966E-2 | H41: 0.14383561643835618 | I41: 0.10769031936450203 | J41: 0.05 | K41: 6.9883690244869123E-2 | L41: 5.5629242226409435E-2 | M41: 9.584664536741215E-2 | N41: 8.4356861959631477E-2
A42: 5 | B42: siehe Unterkriterien | C42: Benutzerfreundlichkeit | D42: 2.7719112988384371E-2 | E42: 3.5844333181611281E-2 | F42: 1.0542168674698794E-2 | G42: 8.0993520518358522E-3 | H42: 2.0547945205479454E-2 | I42: 1.5384331337786003E-2 | J42: 0.03 | K42: 1.7470922561217281E-2 | L42: 1.3907310556602359E-2 | M42: 4.7923322683706075E-2 | N42: 2.5270977693480162E-2
A43: 7 | B43: Ist ein PC nötig? Wird die Bewegungsfreiheit durch Kabel eingeschränkt? | C43: Mobilität des Systems | D43: 2.7719112988384371E-2 | E43: 2.0482476103777875E-2 | F43: 1.0542168674698794E-2 | G43: 8.0993520518358522E-3 | H43: 2.0547945205479454E-2 | I43: 1.5384331337786003E-2 | J43: 0.02 | K43: 1.1646116979307439E-2 | L43: 9.2706132170311314E-3 | M43: 4.7923322683706075E-2 | N43: 2.1290604360222998E-2
A44: 8 | B44: Ist der Software Code öffentlich zugänglich? | C44: Open Source Software | D44: 3.6958817317845824E-2 | E44: 1.5930814747382793E-2 | F44: 4.5180722891566263E-3 | G44: 1.1339092872570193E-2 | H44: 6.8493150684931503E-3 | I44: 7.6921656688930017E-3 | J44: 0.01 | K44: 4.9916921603477948E-3 | L44: 3.9735173018863876E-3 | M44: 1.5974440894568693E-2 | N44: 1.3136436480127162E-2
A45: 9 | B45: Werden die verwendeten, technischen Komponenten vom Hersteller offgelegt? | C45: Open Hardware | D45: 1.5839493136219639E-2 | E45: 3.5844333181611281E-2 | F45: 1.5813253012048192E-2 | G45: 2.8347732181425483E-2 | H45: 4.1095890410958909E-2 | I45: 4.6157609774335445E-2 | J45: 7.0000000000000007E-2 | K45: 3.4941845122434562E-2 | L45: 8.3443863339614149E-2 | M45: 1.5974440894568693E-2 | N45: 4.3050940117024039E-2
A46: 10 | B46: Anzahl und Art | C46: Verfügbare Software | D46: 0.11087645195353749 | E46: 2.8675466545289029E-2 | F46: 1.5813253012048192E-2 | G46: 2.8347732181425483E-2 | H46: 4.1095890410958909E-2 | I46: 4.6157609774335445E-2 | J46: 7.0000000000000007E-2 | K46: 1.1647281707478186E-2 | L46: 2.7814621113204718E-2 | M46: 9.5846645367412154E-3 | N46: 4.333477458166874E-2
A47: 11 | B47: Wie leicht ist eine native Entwicklung möglich? | C47: Entwicklung für diese Plattform | D47: 0.5 | E47: 0.5 | F47: 0.5 | G47: 0.5 | H47: 0.5 | I47: 0.5 | J47: 0.5 | K47: 0.5 | L47: 0.5 | M47: 4.7923322683706075E-2 | N47: 0.50532481363152293

Sheet: Gewichtung Tragekomfort
C1: CR Value = | D1: =R[22]C[3] -> #DIV/0!
C2: Pairwise comparisons
A3: Item Number | C3: Item Number | D3: 1 | E3: 2 | I3: ONLY ENTER in the yellow fields
C4: Item Description | D4: Gewicht | E4: Polsterung | I4: Item Descriptions can be text
A5: 1 | B5: Gewicht der Brille | C5: Gewicht | D5: 1 | E5: 4
A6: 2 | B6: Wie bequem ist die Polsterung? | C6: Polsterung | D6: =IF(R[-1]C[1]="","",1/R[-1]C[1]) -> 0.25 | E6: 1
C7: Sum | D7: =IF(R[-2]C="","",SUM(R[-2]C:R[-1]C)) -> 1.25 | E7: =IF(R[-2]C="","",SUM(R[-2]C:R[-1]C)) -> 5
C9: STANDARDIZED MATRIX
D10: =R[-6]C -> Gewicht | E10: =R[-6]C -> Polsterung | F10: Weight
A11: 1 | B11: Gewicht der Brille | C11: =IF(R[-6]C="","",R[-6]C) -> Gewicht | D11: =IF(R[-6]C="","",R[-6]C/R7C4) -> 0.8 | E11: =IF(R[-6]C="","",R[-6]C/R7C) -> 0.8 | F11: =IF(RC[-2]="","",(SUM(RC[-2]:RC[-1])/R20C7)) -> 0.8
A12: 2 | B12: Wie bequem ist die Polsterung? | C12: =IF(R[-6]C="","",R[-6]C) -> Polsterung | D12: =IF(R[-6]C="","",R[-6]C/R7C4) -> 0.2 | E12: =IF(R[-7]C="","",R[-6]C/R7C5) -> 0.2 | F12: =IF(RC[-2]="","",(SUM(RC[-2]:RC[-1])/R20C7)) -> 0.2
C15: CI and CR worksheet
D16: =R[-6]C -> Gewicht | E16: =R[-6]C -> Polsterung | F16: SUM | G16: SUM/Weight
A17: 1 | B17: Gewicht der Brille | C17: =R[-6]C -> Gewicht | D17: =IF(R[-12]C="","",R[-12]C*R11C6) -> 0.8 | E17: =IF(R[-12]C="","",R[-12]C*R12C6) -> 0.8 | F17: =IF(RC[-2]="","",SUM(RC[-2]:RC[-1])) -> 1.6 | G17: =IF(RC[-1]="","",RC[-1]/R[-6]C6) -> 2
A18: 2 | B18: Wie bequem ist die Polsterung? | C18: =R[-6]C -> Polsterung | D18: =IF(R[-12]C="","",R[-12]C*R11C6) -> 0.2 | E18: =IF(R[-13]C="","",R[-12]C*R12C6) -> 0.2 | F18: =IF(RC[-2]="","",SUM(RC[-2]:RC[-1])) -> 0.4 | G18: =IF(RC[-1]="","",RC[-1]/R[-6]C6) -> 2
F20: count | G20: =COUNTA(R[-15]C[-4]:R[-14]C[-4]) -> 2
F21: lambda max | G21: =(SUM(R[-4]C:R[-3]C))/(COUNT(R[-4]C:R[-3]C)) -> 2
F22: CI | G22: =(R[-1]C-R[-2]C)/(R[-2]C-1) -> 0
F23: CR | G23: =R[-1]C/R[1]C -> #DIV/0!
F24: constant | G24: =IF(R[-4]C=R[5]C[-4],R[5]C[-3],IF(R[-4]C=R[6]C[-4],R[6]C[-3],IF(R[-4]C=R[7]C[-4],R[7]C[-3],IF(R[-4]C=R[8]C[-4],R[8]C[-3],IF(R[-4]C=R[9]C[-4],R[9]C[-3],IF(R[-4]C=R[10]C[-4],R[10]C[-3],IF(R[-4]C=R[11]C[-4],R[11]C[-3],IF(R[-4]C=R[12]C[-4],R[12]C[-3],R[13]C[-3])))))))) -> 0
C26: Saaty’s CIr values for matrices are given by the following table
C27: Anzahl der Dimensionen n | D27: Random Consistency
C28: 1 | D28: 0 | E28: 1
C29: 2 | D29: 0 | E29: 2
C30: 3 | D30: 0.57999999999999996 | E30: 3
C31: 4 | D31: 0.9 | E31: 4
C32: 5 | D32: 1.1200000000000001 | E32: 5
C33: 6 | D33: 1.24 | E33: 6
C34: 7 | D34: 1.32 | E34: 7
C35: 8 | D35: 1.41 | E35: 8
C36: 9 | D36: 1.45 | E36: 9
C37: 10 | D37: 1.49 | E37: 10

Sheet: GewichtungQualitätDerImmersio
C1: CR Value = | D1: =R[31]C[6] -> 8.559273168209805E-2 | F1: =IF(RC[-2]<0.1,"Reasonable Consistency","Not Consistent") -> Reasonable Consistency
C2: Pairwise comparisons
A3: Item Number | C3: Item Number | D3: 1 | E3: 2 | F3: 3 | G3: 4 | H3: 5 | L3: ONLY ENTER in the yellow fields
C4: Item Description | D4: =T(R[1]C[-1]) -> Displayauflösung | E4: =T(R[2]C[-2]) -> Qualität der Texturen | F4: =T(R[3]C[-3]) -> Präzession des Trackings | G4: =T(R[4]C[-4]) -> FPS | H4: =T(R[5]C[-5]) -> Sichtfeld | L4: Item Descriptions can be text
A5: 1 | C5: Displayauflösung | D5: 1 | E5: 1 | F5: 0.33329999999999999 | G5: 0.2 | H5: 1 | I5: 3
A6: 2 | B6: Wie aufwändig ist die Grafik der Simulation | C6: Qualität der Texturen | D6: =IF(R[-1]C[1]="","",1/R[-1]C[1]) -> 1 | E6: 1 | F6: 0.33329999999999999 | G6: 0.2 | H6: 1 | I6: 3
A7: 3 | B7: Wie präzise kann die Simulation meinen Kopfbewegungen folgen | C7: Präzession des Trackings | D7: =IF(R[-2]C[2]="","",1/R[-2]C[2]) -> 3.0003000300030003 | E7: =IF(R[-1]C[1]="","",1/R[-1]C[1]) -> 3.0003000300030003 | F7: 1 | G7: 3 | H7: 6 | I7: 1
A8: 4 | B8: Bilder pro Sekunde | C8: FPS | D8: =IF(R[-3]C[3]="","",1/R[-3]C[3]) -> 5 | E8: =IF(R[-2]C[2]="","",1/R[-2]C[2]) -> 5 | F8: =IF(R[-1]C[1]="","",1/R[-1]C[1]) -> 0.33333333333333331 | G8: 1 | H8: 9 | I8: 3
A9: 5 | B9: Welches Sichtfeld bietet die Darstellung durch die Brille | C9: Sichtfeld | D9: =IF(R[-4]C[4]="","",1/R[-4]C[4]) -> 1 | E9: =IF(R[-3]C[3]="","",1/R[-3]C[3]) -> 1 | F9: =IF(R[-2]C[2]="","",1/R[-2]C[2]) -> 0.16666666666666666 | G9: =IF(R[-1]C[1]="","",1/R[-1]C[1]) -> 0.1111111111111111 | H9: 1 | I9: 1
C10: Sum | D10: =IF(R[-5]C="","",SUM(R[-5]C:R[-1]C)) -> 11.000300030003 | E10: =IF(R[-5]C="","",SUM(R[-5]C:R[-1]C)) -> 11.000300030003 | F10: =IF(R[-5]C="","",SUM(R[-5]C:R[-1]C)) -> 2.1665999999999999 | G10: =IF(R[-5]C="","",SUM(R[-5]C:R[-1]C)) -> 4.5111111111111111 | H10: =IF(R[-5]C="","",SUM(R[-5]C:R[-1]C)) -> 18 | I10: 1
C12: STANDARDIZED MATRIX
D13: =R[-9]C -> Displayauflösung | E13: =R[-9]C -> Qualität der Texturen | F13: =R[-9]C -> Präzession des Trackings | G13: =R[-9]C -> FPS | H13: =R[-9]C -> Sichtfeld | I13: Weight
A14: 1 | C14: =IF(R[-9]C="","",R[-9]C) -> Displayauflösung | D14: =IF(R[-9]C="","",R[-9]C/R10C4) -> 9.0906611389919262E-2 | E14: =IF(R[-9]C="","",R[-9]C/R10C) -> 9.0906611389919262E-2 | F14: =IF(R[-9]C="","",R[-9]C6/R10C) -> 0.15383550263085019 | G14: =IF(R[-9]C="","",R[-9]C7/R10C) -> 4.4334975369458129E-2 | H14: =IF(R[-9]C="","",R[-9]C8/R10C) -> 5.5555555555555552E-2 | I14: =IF(RC[-5]="","",(SUM(RC[-5]:RC[-1])/R29C10)) -> 8.7107851267140463E-2
A15: 2 | B15: Wie aufwändig ist die Grafik der Simulation | C15: =IF(R[-9]C="","",R[-9]C) -> Qualität der Texturen | D15: =IF(R[-9]C="","",R[-9]C/R10C4) -> 9.0906611389919262E-2 | E15: =IF(R[-10]C="","",R[-9]C/R10C5) -> 9.0906611389919262E-2 | F15: =IF(R[-9]C="","",R[-9]C6/R10C) -> 0.15383550263085019 | G15: =IF(R[-9]C="","",R[-9]C7/R10C) -> 4.4334975369458129E-2 | H15: =IF(R[-9]C="","",R[-9]C8/R10C) -> 5.5555555555555552E-2 | I15: =IF(RC[-5]="","",(SUM(RC[-5]:RC[-1])/R29C10)) -> 8.7107851267140463E-2
A16: 3 | B16: Wie präzise kann die Simulation meinen Kopfbewegungen folgen | C16: =IF(R[-9]C="","",R[-9]C) -> Präzession des Trackings | D16: =IF(R[-9]C="","",R[-9]C/R10C4) -> 0.27274710888064585 | E16: =IF(R[-9]C="","",R[-9]C/R10C5) -> 0.27274710888064585 | F16: =IF(R[-11]C="","",R[-9]C6/R10C) -> 0.46155266315886645 | G16: =IF(R[-9]C="","",R[-9]C7/R10C) -> 0.66502463054187189 | H16: =IF(R[-9]C="","",R[-9]C8/R10C) -> 0.33333333333333331 | I16: =IF(RC[-5]="","",(SUM(RC[-5]:RC[-1])/R29C10)) -> 0.40108096895907269
A17: 4 | B17: Bilder pro Sekunde | C17: =IF(R[-9]C="","",R[-9]C) -> FPS | D17: =IF(R[-9]C="","",R[-9]C/R10C4) -> 0.45453305694959634 | E17: =IF(R[-9]C="","",R[-9]C/R10C5) -> 0.45453305694959634 | F17: =IF(R[-9]C="","",R[-9]C6/R10C) -> 0.15385088771962213 | G17: =IF(R[-12]C="","",R[-9]C7/R10C) -> 0.22167487684729065 | H17: =IF(R[-9]C="","",R[-9]C8/R10C) -> 0.5 | I17: =IF(RC[-5]="","",(SUM(RC[-5]:RC[-1])/R29C10)) -> 0.3569183756932211
A18: 5 | B18: Welches Sichtfeld bietet die Darstellung durch die Brille | C18: =IF(R[-9]C="","",R[-9]C) -> Sichtfeld | D18: =IF(R[-9]C="","",R[-9]C/R10C4) -> 9.0906611389919262E-2 | E18: =IF(R[-9]C="","",R[-9]C/R10C5) -> 9.0906611389919262E-2 | F18: =IF(R[-9]C="","",R[-9]C6/R10C) -> 7.6925443859811066E-2 | G18: =IF(R[-9]C="","",R[-9]C7/R10C) -> 2.463054187192118E-2 | H18: =IF(R[-13]C="","",R[-9]C8/R10C) -> 5.5555555555555552E-2 | I18: =IF(RC[-5]="","",(SUM(RC[-5]:RC[-1])/R29C10)) -> 6.7784952813425267E-2
C21: CI and CR worksheet
D22: =R[-9]C -> Displayauflösung | E22: =R[-9]C -> Qualität der Texturen | F22: =R[-9]C -> Präzession des Trackings | G22: =R[-9]C -> FPS | H22: =R[-9]C -> Sichtfeld | I22: SUM | J22: SUM/Weight
A23: 1 | C23: =R[-9]C -> Displayauflösung | D23: =IF(R[-18]C="","",R[-18]C*R14C9) -> 8.7107851267140463E-2 | E23: =IF(R[-18]C="","",R[-18]C*R15C9) -> 8.7107851267140463E-2 | F23: =IF(R[-18]C="","",R[-18]C*R16C9) -> 0.13368028695405892 | G23: =IF(R[-18]C="","",R[-18]C*R17C9) -> 7.1383675138644229E-2 | H23: =IF(R[-18]C="","",R[-18]C*R18C9) -> 6.7784952813425267E-2 | I23: =IF(RC[-5]="","",SUM(RC[-5]:RC[-1])) -> 0.44706461744040937 | J23: =IF(RC[-1]="","",RC[-1]/R[-9]C9) -> 5.1323113925673738
A24: 2 | B24: Wie aufwändig ist die Grafik der Simulation | C24: =R[-9]C -> Qualität der Texturen | D24: =IF(R[-18]C="","",R[-18]C*R14C9) -> 8.7107851267140463E-2 | E24: =IF(R[-19]C="","",R[-18]C*R15C9) -> 8.7107851267140463E-2 | F24: =IF(R[-18]C="","",R[-18]C*R16C9) -> 0.13368028695405892 | G24: =IF(R[-18]C="","",R[-18]C*R17C9) -> 7.1383675138644229E-2 | H24: =IF(R[-18]C="","",R[-18]C*R18C9) -> 6.7784952813425267E-2 | I24: =IF(RC[-5]="","",SUM(RC[-5]:RC[-1])) -> 0.44706461744040937 | J24: =IF(RC[-1]="","",RC[-1]/R[-9]C9) -> 5.1323113925673738
A25: 3 | B25: Wie präzise kann die Simulation meinen Kopfbewegungen folgen | C25: =R[-9]C -> Präzession des Trackings | D25: =IF(R[-18]C="","",R[-18]C*R14C9) -> 0.26134968877029841 | E25: =IF(R[-18]C="","",R[-18]C*R15C9) -> 0.26134968877029841 | F25: =IF(R[-20]C="","",R[-18]C*R16C9) -> 0.40108096895907269 | G25: =IF(R[-18]C="","",R[-18]C*R17C9) -> 1.0707551270796634 | H25: =IF(R[-18]C="","",R[-18]C*R18C9) -> 0.40670971688055158 | I25: =IF(RC[-5]="","",SUM(RC[-5]:RC[-1])) -> 2.4012451904598846 | J25: =IF(RC[-1]="","",RC[-1]/R[-9]C9) -> 5.9869337522841022
A26: 4 | B26: Bilder pro Sekunde | C26: =R[-9]C -> FPS | D26: =IF(R[-18]C="","",R[-18]C*R14C9) -> 0.43553925633570234 | E26: =IF(R[-18]C="","",R[-18]C*R15C9) -> 0.43553925633570234 | F26: =IF(R[-18]C="","",R[-18]C*R16C9) -> 0.13369365631969088 | G26: =IF(R[-21]C="","",R[-18]C*R17C9) -> 0.3569183756932211 | H26: =IF(R[-18]C="","",R[-18]C*R18C9) -> 0.61006457532082736 | I26: =IF(RC[-5]="","",SUM(RC[-5]:RC[-1])) -> 1.971755120005144 | J26: =IF(RC[-1]="","",RC[-1]/R[-9]C9) -> 5.5243866785382583
A27: 5 | B27: Welches Sichtfeld bietet die Darstellung durch die Brille | C27: =R[-9]C -> Sichtfeld | D27: =IF(R[-18]C="","",R[-18]C*R14C9) -> 8.7107851267140463E-2 | E27: =IF(R[-18]C="","",R[-18]C*R15C9) -> 8.7107851267140463E-2 | F27: =IF(R[-18]C="","",R[-18]C*R16C9) -> 6.6846828159845439E-2 | G27: =IF(R[-18]C="","",R[-18]C*R17C9) -> 3.965759729924679E-2 | H27: =IF(R[-22]C="","",R[-18]C*R18C9) -> 6.7784952813425267E-2 | I27: =IF(RC[-5]="","",SUM(RC[-5]:RC[-1])) -> 0.34850508080679843 | J27: =IF(RC[-1]="","",RC[-1]/R[-9]C9) -> 5.1413339737218884
I29: count | J29: =COUNTA(R[-24]C[-7]:R[-20]C[-7]) -> 5
I30: lambda max | J30: =(SUM(R[-7]C:R[-3]C))/(COUNT(R[-7]C:R[-3]C)) -> 5.3834554379357993
I31: CI | J31: =(R[-1]C-R[-2]C)/(R[-2]C-1) -> 9.586385948394982E-2
I32: CR | J32: =R[-1]C/R[1]C -> 8.559273168209805E-2
I33: constant | J33: =IF(R[-4]C=R[5]C[-7],R[5]C[-6],IF(R[-4]C=R[6]C[-7],R[6]C[-6],IF(R[-4]C=R[7]C[-7],R[7]C[-6],IF(R[-4]C=R[8]C[-7],R[8]C[-6],IF(R[-4]C=R[9]C[-7],R[9]C[-6],IF(R[-4]C=R[10]C[-7],R[10]C[-6],IF(R[-4]C=R[11]C[-7],R[11]C[-6],IF(R[-4]C=R[12]C[-7],R[12]C[-6],R[13]C[-6])))))))) -> 1.1200000000000001
C35: Saaty’s CIr values for matrices are given by the following table
C36: Size of Matrix | D36: Random Consistency (CIr)
C37: 1 | D37: 0 | E37: 1
C38: 2 | D38: 0 | E38: 2
C39: 3 | D39: 0.57999999999999996 | E39: 3
C40: 4 | D40: 0.9 | E40: 4
C41: 5 | D41: 1.1200000000000001 | E41: 5
C42: 6 | D42: 1.24 | E42: 6
C43: 7 | D43: 1.32 | E43: 7
C44: 8 | D44: 1.41 | E44: 8
C45: 9 | D45: 1.45 | E45: 9
C46: 10 | D46: 1.49 | E46: 10

Sheet: GewichtungBenutzerfreundlichkei
C1: CR Value = | D1: =R[25]C[4] -> 7.4973835635568434E-2 | F1: =IF(RC[-2]<0.1,"Reasonable Consistency","Not Consistent") -> Reasonable Consistency
C2: Pairwise comparisons
A3: Item Number | C3: Item Number | D3: 1 | E3: 2 | F3: 3 | J3: ONLY ENTER in the yellow fields
C4: Item Description | D4: =T(R[1]C[-1]) -> Inbetriebnahme | E4: =T(R[2]C[-2]) -> Bedienbarkeit | F4: =T(R[3]C[-3]) -> Dokumentation | J4: Item Descriptions can be text
A5: 1 | B5: Wie leicht fällt die erste Inbetriebnahme | C5: Inbetriebnahme | D5: 1 | E5: 0.33329999999999999 | F5: =1/5 -> 0.2
A6: 2 | B6: Wie leicht fällt die der Umgang bzw. die Handhabung mit der Brille | C6: Bedienbarkeit | D6: =IF(R[-1]C[1]="","",1/R[-1]C[1]) -> 3.0003000300030003 | E6: 1 | F6: =1/4 -> 0.25
A7: 3 | B7: Welche Hilfestellung wird vom Hersteller bereitgestellt | C7: Dokumentation | D7: =IF(R[-2]C[2]="","",1/R[-2]C[2]) -> 5 | E7: =IF(R[-1]C[1]="","",1/R[-1]C[1]) -> 4 | F7: 1
C8: Sum | D8: =IF(R[-3]C="","",SUM(R[-3]C:R[-1]C)) -> 9.0003000300030003 | E8: =IF(R[-3]C="","",SUM(R[-3]C:R[-1]C)) -> 5.3332999999999995 | F8: =IF(R[-3]C="","",SUM(R[-3]C:R[-1]C)) -> 1.45
C10: STANDARDIZED MATRIX
D11: =R[-7]C -> Inbetriebnahme | E11: =R[-7]C -> Bedienbarkeit | F11: =R[-7]C -> Dokumentation | G11: Weight
A12: 1 | B12: Wie leicht fällt die erste Inbetriebnahme | C12: =IF(R[-7]C="","",R[-7]C) -> Inbetriebnahme | D12: =IF(R[-7]C="","",R[-7]C/R8C4) -> 0.11110740716047736 | E12: =IF(R[-7]C="","",R[-7]C/R8C) -> 6.2494140588378683E-2 | F12: =IF(R[-7]C="","",R[-7]C6/R8C) -> 0.13793103448275862 | G12: =IF(RC[-3]="","",(SUM(RC[-3]:RC[-1])/R23C8)) -> 0.1038441940772049
A13: 2 | B13: Wie leicht fällt die der Umgang bzw. die Handhabung mit der Brille | C13: =IF(R[-7]C="","",R[-7]C) -> Bedienbarkeit | D13: =IF(R[-7]C="","",R[-7]C/R8C4) -> 0.33335555703713582 | E13: =IF(R[-8]C="","",R[-7]C/R8C5) -> 0.18750117188232429 | F13: =IF(R[-7]C="","",R[-7]C6/R8C) -> 0.17241379310344829 | G13: =IF(RC[-3]="","",(SUM(RC[-3]:RC[-1])/R23C8)) -> 0.23109017400763612
A14: 3 | B14: Welche Hilfestellung wird vom Hersteller bereitgestellt | C14: =IF(R[-7]C="","",R[-7]C) -> Dokumentation | D14: =IF(R[-7]C="","",R[-7]C/R8C4) -> 0.55553703580238678 | E14: =IF(R[-7]C="","",R[-7]C/R8C5) -> 0.75000468752929716 | F14: =IF(R[-9]C="","",R[-7]C6/R8C) -> 0.68965517241379315 | G14: =IF(RC[-3]="","",(SUM(RC[-3]:RC[-1])/R23C8)) -> 0.66506563191515899
C17: CI and CR worksheet
D18: =R[-7]C -> Inbetriebnahme | E18: =R[-7]C -> Bedienbarkeit | F18: =R[-7]C -> Dokumentation | G18: SUM | H18: SUM/Weight
A19: 1 | B19: Wie leicht fällt die erste Inbetriebnahme | C19: =R[-7]C -> Inbetriebnahme | D19: =IF(R[-14]C="","",R[-14]C*R12C7) -> 0.1038441940772049 | E19: =IF(R[-14]C="","",R[-14]C*R13C7) -> 7.7022354996745118E-2 | F19: =IF(R[-14]C="","",R[-14]C*R14C7) -> 0.13301312638303181 | G19: =IF(RC[-3]="","",SUM(RC[-3]:RC[-1])) -> 0.31387967545698181 | H19: =IF(RC[-1]="","",RC[-1]/R[-7]C7) -> 3.0226020650092593
A20: 2 | B20: Wie leicht fällt die der Umgang bzw. die Handhabung mit der Brille | C20: =R[-7]C -> Bedienbarkeit | D20: =IF(R[-14]C="","",R[-14]C*R12C7) -> 0.31156373860547526 | E20: =IF(R[-15]C="","",R[-14]C*R13C7) -> 0.23109017400763612 | F20: =IF(R[-14]C="","",R[-14]C*R14C7) -> 0.16626640797878975 | G20: =IF(RC[-3]="","",SUM(RC[-3]:RC[-1])) -> 0.70892032059190113 | H20: =IF(RC[-1]="","",RC[-1]/R[-7]C7) -> 3.0677216096971551
A21: 3 | B21: Welche Hilfestellung wird vom Hersteller bereitgestellt | C21: =R[-7]C -> Dokumentation | D21: =IF(R[-14]C="","",R[-14]C*R12C7) -> 0.51922097038602444 | E21: =IF(R[-14]C="","",R[-14]C*R13C7) -> 0.92436069603054449 | F21: =IF(R[-16]C="","",R[-14]C*R14C7) -> 0.66506563191515899 | G21: =IF(RC[-3]="","",SUM(RC[-3]:RC[-1])) -> 2.1086472983317281 | H21: =IF(RC[-1]="","",RC[-1]/R[-7]C7) -> 3.1705852733053628
G23: count | H23: =COUNTA(R[-18]C[-5]:R[-16]C[-5]) -> 3
G24: lambda max | H24: =(SUM(R[-5]C:R[-3]C))/(COUNT(R[-5]C:R[-3]C)) -> 3.0869696493372594
G25: CI | H25: =(R[-1]C-R[-2]C)/(R[-2]C-1) -> 4.3484824668629685E-2
G26: CR | H26: =R[-1]C/R[1]C -> 7.4973835635568434E-2
G27: constant | H27: =IF(R[-4]C=R[5]C[-5],R[5]C[-4],IF(R[-4]C=R[6]C[-5],R[6]C[-4],IF(R[-4]C=R[7]C[-5],R[7]C[-4],IF(R[-4]C=R[8]C[-5],R[8]C[-4],IF(R[-4]C=R[9]C[-5],R[9]C[-4],IF(R[-4]C=R[10]C[-5],R[10]C[-4],IF(R[-4]C=R[11]C[-5],R[11]C[-4],IF(R[-4]C=R[12]C[-5],R[12]C[-4],R[13]C[-4])))))))) -> 0.57999999999999996
C29: Saaty’s CIr values for matrices are given by the following table
C30: Size of Matrix | D30: Random Consistency (CIr)
C31: 1 | D31: 0 | E31: 1
C32: 2 | D32: 0 | E32: 2
C33: 3 | D33: 0.57999999999999996 | E33: 3
C34: 4 | D34: 0.9 | E34: 4
C35: 5 | D35: 1.1200000000000001 | E35: 5
C36: 6 | D36: 1.24 | E36: 6
C37: 7 | D37: 1.32 | E37: 7
C38: 8 | D38: 1.41 | E38: 8
C39: 9 | D39: 1.45 | E39: 9
C40: 10 | D40: 1.49 | E40: 10

Sheet: Gewichtung Gesamt
C1: CR Value = | D1: =R[44]C[10] -> -0.62035450583843021 | F1: =IF(RC[-2]<0.1,"Reasonable Consistency","Not Consistent") -> Reasonable Consistency
C2: Pairwise comparisons
A3: Item Number | C3: Item Number | D3: 1 | E3: 2 | F3: 3 | G3: 4 | H3: 5 | I3: 6 | J3: 7 | K3: 8 | L3: 9 | M3: 10 | P3: ONLY ENTER in the yellow fields
C4: Item Description | D4: =T(R[1]C[-1]) -> Kosten | E4: =T(R[2]C[-2]) -> Robustheit | F4: =T(R[3]C[-3]) -> Tragekomfort | G4: =T(R[4]C[-4]) -> Qualität der Immersion | H4: =T(R[5]C[-5]) -> Benutzerfreundlichkeit | I4: =T(R[6]C[-6]) -> Mobilität des Systems | J4: =T(R[7]C[-7]) -> Open Source Software | K4: =T(R[8]C[-8]) -> Open Hardware | L4: =T(R[9]C[-9]) -> Verfügbare Software | M4: =T(R[10]C[-10]) -> Entwicklung für diese Plattform | P4: Item Descriptions can be text
A5: 1 | B5: Anschaffung als auch evtl. laufende Kosten | C5: Kosten | D5: 1 | E5: 1 | F5: 5 | G5: 3 | H5: 4 | I5: 7 | J5: 9 | K5: 4 | L5: 4 | M5: 7
A6: 2 | B6: Langlebigkeit der Brille | C6: Robustheit | D6: =IF(R[-1]C[1]="","",1/R[-1]C[1]) -> 1 | E6: 1 | F6: 5 | G6: 3 | H6: 4 | I6: 7 | J6: 9 | K6: 4 | L6: 5 | M6: 7
A7: 3 | B7: siehe Unterkriterien | C7: Tragekomfort | D7: =IF(R[-2]C[2]="","",1/R[-2]C[2]) -> 0.2 | E7: =IF(R[-1]C[1]="","",1/R[-1]C[1]) -> 0.2 | F7: 1 | G7: =1/3 -> 0.33333333333333331 | H7: 3 | I7: 3 | J7: 7 | K7: 2 | L7: 2 | M7: 1
A8: 4 | B8: siehe Unterkriterien | C8: Qualität der Immersion | D8: =IF(R[-3]C[3]="","",1/R[-3]C[3]) -> 0.33333333333333331 | E8: =IF(R[-2]C[2]="","",1/R[-2]C[2]) -> 0.33333333333333331 | F8: =IF(R[-1]C[1]="","",1/R[-1]C[1]) -> 3 | G8: 1 | H8: 7 | I8: 7 | J8: 5 | K8: 2 | L8: 2 | M8: 2
A9: 5 | B9: siehe Unterkriterien | C9: Benutzerfreundlichkeit | D9: =IF(R[-4]C[4]="","",1/R[-4]C[4]) -> 0.25 | E9: =IF(R[-3]C[3]="","",1/R[-3]C[3]) -> 0.25 | F9: =IF(R[-2]C[2]="","",1/R[-2]C[2]) -> 0.33333333333333331 | G9: =IF(R[-1]C[1]="","",1/R[-1]C[1]) -> 0.14285714285714285 | H9: 1 | I9: 1 | J9: 3 | K9: 0.5 | L9: 0.5 | M9: 1
A10: 6 | B10: Ist ein PC nötig? Wird die Bewegungsfreiheit durch Kabel eingeschränkt? | C10: Mobilität des Systems | D10: =IF(R[-5]C[5]="","",1/R[-4]C[4]) -> 0.25 | E10: =IF(R[-4]C[4]="","",1/R[-4]C[4]) -> 0.14285714285714285 | F10: =IF(R[-3]C[3]="","",1/R[-3]C[3]) -> 0.33333333333333331 | G10: =IF(R[-2]C[2]="","",1/R[-2]C[2]) -> 0.14285714285714285 | H10: =IF(R[-1]C[1]="","",1/R[-1]C[1]) -> 1 | I10: 1 | J10: 2 | K10: 0.33329999999999999 | L10: 0.33329999999999999 | M10: 1
A11: 7 | B11: Ist der Software Code öffentlich zugänglich? | C11: Open Source Software | D11: =IF(R[-6]C[6]="","",1/R[-4]C[4]) -> 0.33333333333333331 | E11: =IF(R[-5]C[5]="","",1/R[-5]C[5]) -> 0.1111111111111111 | F11: =IF(R[-4]C[4]="","",1/R[-4]C[4]) -> 0.14285714285714285 | G11: =IF(R[-3]C[3]="","",1/R[-3]C[3]) -> 0.2 | H11: =IF(R[-2]C[2]="","",1/R[-2]C[2]) -> 0.33333333333333331 | I11: =IF(R[-1]C[1]="","",1/R[-1]C[1]) -> 0.5 | J11: 1 | K11: =1/7 -> 0.14285714285714285 | L11: =1/7 -> 0.14285714285714285 | M11: =1/3 -> 0.33333333333333331
A12: 8 | B12: Werden die verwendeten, technischen Komponenten vom Hersteller offgelegt? | C12: Open Hardware | D12: =IF(R[-7]C[7]="","",1/R[-4]C[4]) -> 0.14285714285714285 | E12: =IF(R[-6]C[6]="","",1/R[-6]C[6]) -> 0.25 | F12: =IF(R[-5]C[5]="","",1/R[-5]C[5]) -> 0.5 | G12: =IF(R[-4]C[4]="","",1/R[-4]C[4]) -> 0.5 | H12: =IF(R[-3]C[3]="","",1/R[-3]C[3]) -> 2 | I12: =IF(R[-2]C[2]="","",1/R[-2]C[2]) -> 3.0003000300030003 | J12: =IF(R[-1]C[1]="","",1/R[-1]C[1]) -> 7 | K12: 1 | L12: 3 | M12: =1/3 -> 0.33333333333333331
A13: 9 | B13: Anzahl und Art | C13: Verfügbare Software | D13: =IF(R[-8]C[8]="","",1/R[-4]C[4]) -> 1 | E13: =IF(R[-7]C[7]="","",1/R[-7]C[7]) -> 0.2 | F13: =IF(R[-6]C[6]="","",1/R[-6]C[6]) -> 0.5 | G13: =IF(R[-5]C[5]="","",1/R[-5]C[5]) -> 0.5 | H13: =IF(R[-4]C[4]="","",1/R[-4]C[4]) -> 2 | I13: =IF(R[-3]C[3]="","",1/R[-3]C[3]) -> 3.0003000300030003 | J13: =IF(R[-2]C[2]="","",1/R[-2]C[2]) -> 7 | K13: =IF(R[-1]C[1]="","",1/R[-1]C[1]) -> 0.33333333333333331 | L13: 1 | M13: 0.2
A14: 10 | B14: Wie leicht ist eine native Entwicklung möglich? | C14: Entwicklung für diese Plattform | D14: =IF(R[-9]C="","",SUM(R[-9]C:R[-1]C)) -> 4.5095238095238095 | E14: =IF(R[-9]C="","",SUM(R[-9]C:R[-1]C)) -> 3.4873015873015878 | F14: =IF(R[-9]C="","",SUM(R[-9]C:R[-1]C)) -> 15.80952380952381 | G14: =IF(R[-9]C="","",SUM(R[-9]C:R[-1]C)) -> 8.8190476190476197 | H14: =IF(R[-9]C="","",SUM(R[-9]C:R[-1]C)) -> 24.333333333333332 | I14: =IF(R[-9]C="","",SUM(R[-9]C:R[-1]C)) -> 32.500600060006001 | J14: =IF(R[-9]C="","",SUM(R[-9]C:R[-1]C)) -> 50 | K14: =IF(R[-9]C="","",SUM(R[-9]C:R[-1]C)) -> 14.309490476190476 | L14: =IF(R[-9]C="","",SUM(R[-9]C:R[-1]C)) -> 17.97615714285714 | M14: 1
C15: Sum | D15: =IF(R[-10]C="","",SUM(R[-10]C:R[-1]C)) -> 9.019047619047619 | E15: =IF(R[-10]C="","",SUM(R[-10]C:R[-1]C)) -> 6.9746031746031756 | F15: =IF(R[-10]C="","",SUM(R[-10]C:R[-1]C)) -> 31.61904761904762 | G15: =IF(R[-10]C="","",SUM(R[-10]C:R[-1]C)) -> 17.638095238095239 | H15: =IF(R[-10]C="","",SUM(R[-10]C:R[-1]C)) -> 48.666666666666664 | I15: =IF(R[-10]C="","",SUM(R[-10]C:R[-1]C)) -> 65.001200120012001 | J15: =IF(R[-10]C="","",SUM(R[-10]C:R[-1]C)) -> 100 | K15: =IF(R[-10]C="","",SUM(R[-10]C:R[-1]C)) -> 28.618980952380952 | L15: =IF(R[-10]C="","",SUM(R[-10]C:R[-1]C)) -> 35.95231428571428 | M15: =IF(R[-10]C="","",SUM(R[-10]C:R[-1]C)) -> 20.866666666666664
C17: STANDARDIZED MATRIX
D18: =R[-14]C -> Kosten | E18: =R[-14]C -> Robustheit | F18: =R[-14]C -> Tragekomfort | G18: =R[-14]C -> Qualität der Immersion | H18: =R[-14]C -> Benutzerfreundlichkeit | I18: =R[-14]C -> Mobilität des Systems | J18: =R[-14]C -> Open Source Software | K18: =R[-14]C -> Open Hardware | L18: =R[-14]C -> Verfügbare Software | M18: =R[-14]C -> Entwicklung für diese Plattform | N18: Weight
A19: 1 | B19: Anschaffung als auch evtl. laufende Kosten | C19: =IF(R[-14]C="","",R[-14]C) -> Kosten | D19: =IF(R[-14]C="","",R[-14]C/R15C4) -> 0.11087645195353749 | E19: =IF(R[-14]C="","",R[-14]C/R15C) -> 0.14337733272644512 | F19: =IF(R[-14]C="","",R[-14]C6/R15C) -> 0.15813253012048192 | G19: =IF(R[-14]C="","",R[-14]C7/R15C) -> 0.17008639308855289 | H19: =IF(R[-14]C="","",R[-14]C8/R15C) -> 8.2191780821917818E-2 | I19: =IF(R[-14]C="","",R[-14]C9/R15C) -> 0.10769031936450203 | J19: =IF(R[-14]C="","",R[-14]C10/R15C) -> 0.09 | K19: =IF(R[-14]C="","",R[-14]C11/R15C) -> 0.13976738048973825 | L19: =IF(R[-14]C="","",R[-14]C12/R15C) -> 0.11125848445281887 | M19: =IF(R[-14]C="","",R[-14]C13/R15C) -> 0.33546325878594252 | N19: =IF(RC[-10]="","",(SUM(RC[-10]:RC[-1])/R42C14)) -> 0.1609826590893263
A20: 2 | B20: Langlebigkeit der Brille | C20: =IF(R[-14]C="","",R[-14]C) -> Robustheit | D20: =IF(R[-14]C="","",R[-14]C/R15C4) -> 0.11087645195353749 | E20: =IF(R[-15]C="","",R[-14]C/R15C5) -> 0.14337733272644512 | F20: =IF(R[-14]C="","",R[-14]C6/R15C) -> 0.15813253012048192 | G20: =IF(R[-14]C="","",R[-14]C7/R15C) -> 0.17008639308855289 | H20: =IF(R[-14]C="","",R[-14]C8/R15C) -> 8.2191780821917818E-2 | I20: =IF(R[-14]C="","",R[-14]C9/R15C) -> 0.10769031936450203 | J20: =IF(R[-14]C="","",R[-14]C10/R15C) -> 0.09 | K20: =IF(R[-14]C="","",R[-14]C11/R15C) -> 0.13976738048973825 | L20: =IF(R[-14]C="","",R[-14]C12/R15C) -> 0.13907310556602359 | M20: =IF(R[-14]C="","",R[-14]C13/R15C) -> 0.33546325878594252 | N20: =IF(RC[-10]="","",(SUM(RC[-10]:RC[-1])/R42C14)) -> 0.16407317254634907
A21: 3 | B21: siehe Unterkriterien | C21: =IF(R[-14]C="","",R[-14]C) -> Tragekomfort | D21: =IF(R[-14]C="","",R[-14]C/R15C4) -> 2.2175290390707498E-2 | E21: =IF(R[-14]C="","",R[-14]C/R15C5) -> 2.8675466545289029E-2 | F21: =IF(R[-16]C="","",R[-14]C6/R15C) -> 3.1626506024096383E-2 | G21: =IF(R[-14]C="","",R[-14]C7/R15C) -> 1.8898488120950321E-2 | H21: =IF(R[-14]C="","",R[-14]C8/R15C) -> 6.164383561643836E-2 | I21: =IF(R[-14]C="","",R[-14]C9/R15C) -> 4.6152994013358012E-2 | J21: =IF(R[-14]C="","",R[-14]C10/R15C) -> 7.0000000000000007E-2 | K21: =IF(R[-14]C="","",R[-14]C11/R15C) -> 6.9883690244869123E-2 | L21: =IF(R[-14]C="","",R[-14]C12/R15C) -> 5.5629242226409435E-2 | M21: =IF(R[-14]C="","",R[-14]C13/R15C) -> 4.7923322683706075E-2 | N21: =IF(RC[-10]="","",(SUM(RC[-10]:RC[-1])/R42C14)) -> 5.0289870651758245E-2
A22: 4 | B22: siehe Unterkriterien | C22: =IF(R[-14]C="","",R[-14]C) -> Qualität der Immersion | D22: =IF(R[-14]C="","",R[-14]C/R15C4) -> 3.6958817317845824E-2 | E22: =IF(R[-14]C="","",R[-14]C/R15C5) -> 4.7792444242148374E-2 | F22: =IF(R[-14]C="","",R[-14]C6/R15C) -> 9.4879518072289157E-2 | G22: =IF(R[-17]C="","",R[-14]C7/R15C) -> 5.6695464362850966E-2 | H22: =IF(R[-14]C="","",R[-14]C8/R15C) -> 0.14383561643835618 | I22: =IF(R[-14]C="","",R[-14]C9/R15C) -> 0.10769031936450203 | J22: =IF(R[-14]C="","",R[-14]C10/R15C) -> 0.05 | K22: =IF(R[-14]C="","",R[-14]C11/R15C) -> 6.9883690244869123E-2 | L22: =IF(R[-14]C="","",R[-14]C12/R15C) -> 5.5629242226409435E-2 | M22: =IF(R[-14]C="","",R[-14]C13/R15C) -> 9.584664536741215E-2 | N22: =IF(RC[-10]="","",(SUM(RC[-10]:RC[-1])/R42C14)) -> 8.4356861959631477E-2
A23: 5 | B23: siehe Unterkriterien | C23: =IF(R[-14]C="","",R[-14]C) -> Benutzerfreundlichkeit | D23: =IF(R[-14]C="","",R[-14]C/R15C4) -> 2.7719112988384371E-2 | E23: =IF(R[-14]C="","",R[-14]C/R15C5) -> 3.5844333181611281E-2 | F23: =IF(R[-14]C="","",R[-14]C6/R15C) -> 1.0542168674698794E-2 | G23: =IF(R[-14]C="","",R[-14]C7/R15C) -> 8.0993520518358522E-3 | H23: =IF(R[-18]C="","",R[-14]C8/R15C) -> 2.0547945205479454E-2 | I23: =IF(R[-14]C="","",R[-14]C9/R15C) -> 1.5384331337786003E-2 | J23: =IF(R[-14]C="","",R[-14]C10/R15C) -> 0.03 | K23: =IF(R[-14]C="","",R[-14]C11/R15C) -> 1.7470922561217281E-2 | L23: =IF(R[-14]C="","",R[-14]C12/R15C) -> 1.3907310556602359E-2 | M23: =IF(R[-14]C="","",R[-14]C13/R15C) -> 4.7923322683706075E-2 | N23: =IF(RC[-10]="","",(SUM(RC[-10]:RC[-1])/R42C14)) -> 2.5270977693480162E-2
A24: 7 | B24: Ist ein PC nötig? Wird die Bewegungsfreiheit durch Kabel eingeschränkt? | C24: =IF(R[-14]C="","",R[-14]C) -> Mobilität des Systems | D24: =IF(R[-14]C="","",R[-14]C/R15C4) -> 2.7719112988384371E-2 | E24: =IF(R[-14]C="","",R[-14]C/R15C5) -> 2.0482476103777875E-2 | F24: =IF(R[-14]C="","",R[-14]C6/R15C) -> 1.0542168674698794E-2 | G24: =IF(R[-14]C="","",R[-14]C7/R15C) -> 8.0993520518358522E-3 | H24: =IF(R[-14]C="","",R[-14]C8/R15C) -> 2.0547945205479454E-2 | I24: =IF(R[-19]C="","",R[-14]C9/R15C) -> 1.5384331337786003E-2 | J24: =IF(R[-14]C="","",R[-14]C10/R15C) -> 0.02 | K24: =IF(R[-14]C="","",R[-14]C11/R15C) -> 1.1646116979307439E-2 | L24: =IF(R[-14]C="","",R[-14]C12/R15C) -> 9.2706132170311314E-3 | M24: =IF(R[-14]C="","",R[-14]C13/R15C) -> 4.7923322683706075E-2 | N24: =IF(RC[-10]="","",(SUM(RC[-10]:RC[-1])/R42C14)) -> 2.1290604360222998E-2
A25: 8 | B25: Ist der Software Code öffentlich zugänglich? | C25: =IF(R[-14]C="","",R[-14]C) -> Open Source Software | D25: =IF(R[-14]C="","",R[-14]C/R15C4) -> 3.6958817317845824E-2 | E25: =IF(R[-14]C="","",R[-14]C/R15C5) -> 1.5930814747382793E-2 | F25: =IF(R[-14]C="","",R[-14]C6/R15C) -> 4.5180722891566263E-3 | G25: =IF(R[-14]C="","",R[-14]C7/R15C) -> 1.1339092872570193E-2 | H25: =IF(R[-14]C="","",R[-14]C8/R15C) -> 6.8493150684931503E-3 | I25: =IF(R[-14]C="","",R[-14]C9/R15C) -> 7.6921656688930017E-3 | J25: =IF(R[-20]C="","",R[-14]C10/R15C) -> 0.01 | K25: =IF(R[-14]C="","",R[-14]C11/R15C) -> 4.9916921603477948E-3 | L25: =IF(R[-14]C="","",R[-14]C12/R15C) -> 3.9735173018863876E-3 | M25: =IF(R[-14]C="","",R[-14]C13/R15C) -> 1.5974440894568693E-2 | N25: =IF(RC[-10]="","",(SUM(RC[-10]:RC[-1])/R42C14)) -> 1.3136436480127162E-2
A26: 9 | B26: Werden die verwendeten, technischen Komponenten vom Hersteller offgelegt? | C26: =IF(R[-14]C="","",R[-14]C) -> Open Hardware | D26: =IF(R[-14]C="","",R[-14]C/R15C4) -> 1.5839493136219639E-2 | E26: =IF(R[-14]C="","",R[-14]C/R15C5) -> 3.5844333181611281E-2 | F26: =IF(R[-14]C="","",R[-14]C6/R15C) -> 1.5813253012048192E-2 | G26: =IF(R[-14]C="","",R[-14]C7/R15C) -> 2.8347732181425483E-2 | H26: =IF(R[-14]C="","",R[-14]C8/R15C) -> 4.1095890410958909E-2 | I26: =IF(R[-14]C="","",R[-14]C9/R15C) -> 4.6157609774335445E-2 | J26: =IF(R[-14]C="","",R[-14]C10/R15C) -> 7.0000000000000007E-2 | K26: =IF(R[-21]C="","",R[-14]C11/R15C) -> 3.4941845122434562E-2 | L26: =IF(R[-14]C="","",R[-14]C12/R15C) -> 8.3443863339614149E-2 | M26: =IF(R[-14]C="","",R[-14]C13/R15C) -> 1.5974440894568693E-2 | N26: =IF(RC[-10]="","",(SUM(RC[-10]:RC[-1])/R42C14)) -> 4.3050940117024039E-2
A27: 10 | B27: Anzahl und Art | C27: =IF(R[-14]C="","",R[-14]C) -> Verfügbare Software | D27: =IF(R[-14]C="","",R[-14]C/R15C4) -> 0.11087645195353749 | E27: =IF(R[-14]C="","",R[-14]C/R15C5) -> 2.8675466545289029E-2 | F27: =IF(R[-14]C="","",R[-14]C6/R15C) -> 1.5813253012048192E-2 | G27: =IF(R[-14]C="","",R[-14]C7/R15C) -> 2.8347732181425483E-2 | H27: =IF(R[-14]C="","",R[-14]C8/R15C) -> 4.1095890410958909E-2 | I27: =IF(R[-14]C="","",R[-14]C9/R15C) -> 4.6157609774335445E-2 | J27: =IF(R[-14]C="","",R[-14]C10/R15C) -> 7.0000000000000007E-2 | K27: =IF(R[-14]C="","",R[-14]C11/R15C) -> 1.1647281707478186E-2 | L27: =IF(R[-22]C="","",R[-14]C12/R15C) -> 2.7814621113204718E-2 | M27: =IF(R[-14]C="","",R[-14]C13/R15C) -> 9.5846645367412154E-3 | N27: =IF(RC[-10]="","",(SUM(RC[-10]:RC[-1])/R42C14)) -> 4.333477458166874E-2
A28: 11 | B28: Wie leicht ist eine native Entwicklung möglich? | C28: =IF(R[-14]C="","",R[-14]C) -> Entwicklung für diese Plattform | D28: =IF(R[-14]C="","",R[-14]C/R15C4) -> 0.5 | E28: =IF(R[-14]C="","",R[-14]C/R15C5) -> 0.5 | F28: =IF(R[-14]C="","",R[-14]C6/R15C) -> 0.5 | G28: =IF(R[-14]C="","",R[-14]C7/R15C) -> 0.5 | H28: =IF(R[-14]C="","",R[-14]C8/R15C) -> 0.5 | I28: =IF(R[-14]C="","",R[-14]C9/R15C) -> 0.5 | J28: =IF(R[-14]C="","",R[-14]C10/R15C) -> 0.5 | K28: =IF(R[-14]C="","",R[-14]C11/R15C) -> 0.5 | L28: =IF(R[-22]C="","",R[-14]C12/R15C) -> 0.5 | M28: =IF(R[-14]C="","",R[-14]C13/R15C) -> 4.7923322683706075E-2 | N28: =IF(RC[-10]="","",(SUM(RC[-10]:RC[-1])/R42C14)) -> 0.50532481363152293
C30: CI and CR worksheet
D31: =R[-13]C -> Kosten | E31: =R[-13]C -> Robustheit | F31: =R[-13]C -> Tragekomfort | G31: =R[-13]C -> Qualität der Immersion | H31: =R[-13]C -> Benutzerfreundlichkeit | I31: =R[-13]C -> Mobilität des Systems | J31: =R[-13]C -> Open Source Software | K31: =R[-13]C -> Open Hardware | L31: =R[-13]C -> Verfügbare Software | M31: =R[-13]C -> Entwicklung für diese Plattform | N31: SUM | O31: SUM/Weight
A32: 1 | B32: Anschaffung als auch evtl. laufende Kosten | C32: =R[-13]C -> Kosten | D32: =IF(R[-27]C="","",R[-27]C*R19C14) -> 0.1609826590893263 | E32: =IF(R[-27]C="","",R[-27]C*R20C14) -> 0.16407317254634907 | F32: =IF(R[-27]C="","",R[-27]C*R21C14) -> 0.25144935325879125 | G32: =IF(R[-27]C="","",R[-27]C*R22C14) -> 0.25307058587889442 | H32: =IF(R[-27]C="","",R[-27]C*R23C14) -> 0.10108391077392065 | I32: =IF(R[-27]C="","",R[-27]C*R24C14) -> 0.14903423052156098 | J32: =IF(R[-27]C="","",R[-27]C*R25C14) -> 0.11822792832114445 | K32: =IF(R[-27]C="","",R[-27]C*R26C14) -> 0.17220376046809616 | L32: =IF(R[-27]C="","",R[-27]C*R27C14) -> 0.17333909832667496 | M32: =IF(R[-27]C="","",R[-27]C*R28C14) -> 3.5372736954206605 | N32: =IF(RC[-10]="","",SUM(RC[-10]:RC[-1])) -> 5.0807383946054188 | O32: =IF(RC[-1]="","",RC[-1]/R[-13]C14) -> 31.560780666358674
A33: 2 | B33: Langlebigkeit der Brille | C33: =R[-13]C -> Robustheit | D33: =IF(R[-27]C="","",R[-27]C*R19C14) -> 0.1609826590893263 | E33: =IF(R[-28]C="","",R[-27]C*R20C14) -> 0.16407317254634907 | F33: =IF(R[-27]C="","",R[-27]C*R21C14) -> 0.25144935325879125 | G33: =IF(R[-27]C="","",R[-27]C*R22C14) -> 0.25307058587889442 | H33: =IF(R[-27]C="","",R[-27]C*R23C14) -> 0.10108391077392065 | I33: =IF(R[-27]C="","",R[-27]C*R24C14) -> 0.14903423052156098 | J33: =IF(R[-27]C="","",R[-27]C*R25C14) -> 0.11822792832114445 | K33: =IF(R[-27]C="","",R[-27]C*R26C14) -> 0.17220376046809616 | L33: =IF(R[-27]C="","",R[-27]C*R27C14) -> 0.2166738729083437 | M33: =IF(R[-27]C="","",R[-27]C*R28C14) -> 3.5372736954206605 | N33: =IF(RC[-10]="","",SUM(RC[-10]:RC[-1])) -> 5.1240731691870876 | O33: =IF(RC[-1]="","",RC[-1]/R[-13]C14) -> 31.230414391722615
A34: 3 | B34: siehe Unterkriterien | C34: =R[-13]C -> Tragekomfort | D34: =IF(R[-27]C="","",R[-27]C*R19C14) -> 3.2196531817865262E-2 | E34: =IF(R[-27]C="","",R[-27]C*R20C14) -> 3.2814634509269816E-2 | F34: =IF(R[-27]C="","",R[-27]C*R21C14) -> 5.0289870651758245E-2 | G34: =IF(R[-27]C="","",R[-27]C*R22C14) -> 2.8118953986543824E-2 | H34: =IF(R[-27]C="","",R[-27]C*R23C14) -> 7.5812933080440487E-2 | I34: =IF(R[-27]C="","",R[-27]C*R24C14) -> 6.3871813080668999E-2 | J34: =IF(R[-27]C="","",R[-27]C*R25C14) -> 9.1955055360890131E-2 | K34: =IF(R[-27]C="","",R[-27]C*R26C14) -> 8.6101880234048078E-2 | L34: =IF(R[-27]C="","",R[-27]C*R27C14) -> 8.6669549163337481E-2 | M34: =IF(R[-27]C="","",R[-27]C*R28C14) -> 0.50532481363152293 | N34: =IF(RC[-10]="","",SUM(RC[-10]:RC[-1])) -> 1.0531560355163452 | O34: =IF(RC[-1]="","",RC[-1]/R[-13]C14) -> 20.941712950687904
A35: 4 | B35: siehe Unterkriterien | C35: =R[-13]C -> Qualität der Immersion | D35: =IF(R[-27]C="","",R[-27]C*R19C14) -> 5.3660886363108763E-2 | E35: =IF(R[-28]C="","",R[-27]C*R20C14) -> 5.4691057515449684E-2 | F35: =IF(R[-27]C="","",R[-27]C*R21C14) -> 0.15086961195527474 | G35: =IF(R[-27]C="","",R[-27]C*R22C14) -> 8.4356861959631477E-2 | H35: =IF(R[-27]C="","",R[-27]C*R23C14) -> 0.17689684385436114 | I35: =IF(R[-27]C="","",R[-27]C*R24C14) -> 0.14903423052156098 | J35: =IF(R[-27]C="","",R[-27]C*R25C14) -> 6.5682182400635808E-2 | K35: =IF(R[-27]C="","",R[-27]C*R26C14) -> 8.6101880234048078E-2 | L35: =IF(R[-27]C="","",R[-27]C*R27C14) -> 8.6669549163337481E-2 | M35: =IF(R[-27]C="","",R[-27]C*R28C14) -> 1.0106496272630459 | N35: =IF(RC[-10]="","",SUM(RC[-10]:RC[-1])) -> 1.9186127312304539 | O35: =IF(RC[-1]="","",RC[-1]/R[-13]C14) -> 22.744003115580519
A36: 5 | B36: siehe Unterkriterien | C36: =R[-13]C -> Benutzerfreundlichkeit | D36: =IF(R[-27]C="","",R[-27]C*R19C14) -> 4.0245664772331574E-2 | E36: =IF(R[-27]C="","",R[-27]C*R20C14) -> 4.1018293136587267E-2 | F36: =IF(R[-27]C="","",R[-27]C*R21C14) -> 1.6763290217252747E-2 | G36: =IF(R[-27]C="","",R[-27]C*R22C14) -> 1.2050980279947353E-2 | H36: =IF(R[-27]C="","",R[-27]C*R23C14) -> 2.5270977693480162E-2 | I36: =IF(R[-27]C="","",R[-27]C*R24C14) -> 2.1290604360222998E-2 | J36: =IF(R[-27]C="","",R[-27]C*R25C14) -> 3.9409309440381485E-2 | K36: =IF(R[-27]C="","",R[-27]C*R26C14) -> 2.152547005851202E-2 | L36: =IF(R[-27]C="","",R[-27]C*R27C14) -> 2.166738729083437E-2 | M36: =IF(R[-27]C="","",R[-27]C*R28C14) -> 0.50532481363152293 | N36: =IF(RC[-10]="","",SUM(RC[-10]:RC[-1])) -> 0.74456679088107292 | O36: =IF(RC[-1]="","",RC[-1]/R[-13]C14) -> 29.463315583281489
A37: 7 | B37: Ist ein PC nötig? Wird die Bewegungsfreiheit durch Kabel eingeschränkt? | C37: =R[-13]C -> Mobilität des Systems | D37: =IF(R[-27]C="","",R[-27]C*R19C14) -> 4.0245664772331574E-2 | E37: =IF(R[-27]C="","",R[-27]C*R20C14) -> 2.3439024649478436E-2 | F37: =IF(R[-27]C="","",R[-27]C*R21C14) -> 1.6763290217252747E-2 | G37: =IF(R[-27]C="","",R[-27]C*R22C14) -> 1.2050980279947353E-2 | H37: =IF(R[-27]C="","",R[-27]C*R23C14) -> 2.5270977693480162E-2 | I37: =IF(R[-27]C="","",R[-27]C*R24C14) -> 2.1290604360222998E-2 | J37: =IF(R[-27]C="","",R[-27]C*R25C14) -> 2.6272872960254323E-2 | K37: =IF(R[-27]C="","",R[-27]C*R26C14) -> 1.4348878341004111E-2 | L37: =IF(R[-27]C="","",R[-27]C*R27C14) -> 1.4443480368070191E-2 | M37: =IF(R[-27]C="","",R[-27]C*R28C14) -> 0.50532481363152293 | N37: =IF(RC[-10]="","",SUM(RC[-10]:RC[-1])) -> 0.69945058727356479 | O37: =IF(RC[-1]="","",RC[-1]/R[-13]C14) -> 32.852547322721406
A38: 8 | B38: Ist der Software Code öffentlich zugänglich? | C38: =R[-13]C -> Open Source Software | D38: =IF(R[-27]C="","",R[-27]C*R19C14) -> 5.3660886363108763E-2 | E38: =IF(R[-28]C="","",R[-27]C*R20C14) -> 1.8230352505149896E-2 | F38: =IF(R[-27]C="","",R[-27]C*R21C14) -> 7.1842672359654636E-3 | G38: =IF(R[-27]C="","",R[-27]C*R22C14) -> 1.6871372391926296E-2 | H38: =IF(R[-27]C="","",R[-27]C*R23C14) -> 8.4236592311600529E-3 | I38: =IF(R[-27]C="","",R[-27]C*R24C14) -> 1.0645302180111499E-2 | J38: =IF(R[-27]C="","",R[-27]C*R25C14) -> 1.3136436480127162E-2 | K38: =IF(R[-27]C="","",R[-27]C*R26C14) -> 6.1501343024320055E-3 | L38: =IF(R[-27]C="","",R[-27]C*R27C14) -> 6.1906820830955342E-3 | M38: =IF(R[-27]C="","",R[-27]C*R28C14) -> 0.16844160454384097 | N38: =IF(RC[-10]="","",SUM(RC[-10]:RC[-1])) -> 0.30893469731691758 | O38: =IF(RC[-1]="","",RC[-1]/R[-13]C14) -> 23.517389802346692
A39: 9 | B39: Werden die verwendeten, technischen Komponenten vom Hersteller offgelegt? | C39: =R[-13]C -> Open Hardware | D39: =IF(R[-27]C="","",R[-27]C*R19C14) -> 2.2997522727046613E-2 | E39: =IF(R[-27]C="","",R[-27]C*R20C14) -> 4.1018293136587267E-2 | F39: =IF(R[-27]C="","",R[-27]C*R21C14) -> 2.5144935325879123E-2 | G39: =IF(R[-27]C="","",R[-27]C*R22C14) -> 4.2178430979815738E-2 | H39: =IF(R[-27]C="","",R[-27]C*R23C14) -> 5.0541955386960324E-2 | I39: =IF(R[-27]C="","",R[-27]C*R24C14) -> 6.3878200900759075E-2 | J39: =IF(R[-27]C="","",R[-27]C*R25C14) -> 9.1955055360890131E-2 | K39: =IF(R[-27]C="","",R[-27]C*R26C14) -> 4.3050940117024039E-2 | L39: =IF(R[-27]C="","",R[-27]C*R27C14) -> 0.13000432374500623 | M39: =IF(R[-27]C="","",R[-27]C*R28C14) -> 0.16844160454384097 | N39: =IF(RC[-10]="","",SUM(RC[-10]:RC[-1])) -> 0.67921126222380945 | O39: =IF(RC[-1]="","",RC[-1]/R[-13]C14) -> 15.776920559168522
A40: 10 | B40: Anzahl und Art | C40: =R[-13]C -> Verfügbare Software | D40: =IF(R[-27]C="","",R[-27]C*R19C14) -> 0.1609826590893263 | E40: =IF(R[-28]C="","",R[-27]C*R20C14) -> 3.2814634509269816E-2 | F40: =IF(R[-27]C="","",R[-27]C*R21C14) -> 2.5144935325879123E-2 | G40: =IF(R[-27]C="","",R[-27]C*R22C14) -> 4.2178430979815738E-2 | H40: =IF(R[-27]C="","",R[-27]C*R23C14) -> 5.0541955386960324E-2 | I40: =IF(R[-27]C="","",R[-27]C*R24C14) -> 6.3878200900759075E-2 | J40: =IF(R[-27]C="","",R[-27]C*R25C14) -> 9.1955055360890131E-2 | K40: =IF(R[-27]C="","",R[-27]C*R26C14) -> 1.4350313372341345E-2 | L40: =IF(R[-27]C="","",R[-27]C*R27C14) -> 4.333477458166874E-2 | M40: =IF(R[-27]C="","",R[-27]C*R28C14) -> 0.10106496272630459 | N40: =IF(RC[-10]="","",SUM(RC[-10]:RC[-1])) -> 0.62624592223321518 | O40: =IF(RC[-1]="","",RC[-1]/R[-13]C14) -> 14.451348328880579
A41: 11 | B41: Wie leicht ist eine native Entwicklung möglich? | C41: =R[-13]C -> Entwicklung für diese Plattform | D41: =IF(R[-27]C="","",R[-27]C*R19C14) -> 0.72595513408377144 | E41: =IF(R[-27]C="","",R[-27]C*R20C14) -> 0.57217263505449034 | F41: =IF(R[-27]C="","",R[-27]C*R21C14) -> 0.79505890744684471 | G41: =IF(R[-27]C="","",R[-27]C*R22C14) -> 0.7439471826154167 | H41: =IF(R[-27]C="","",R[-27]C*R23C14) -> 0.61492712387468396 | I41: =IF(R[-27]C="","",R[-27]C*R24C14) -> 0.69195741734742755 | J41: =IF(R[-27]C="","",R[-27]C*R25C14) -> 0.65682182400635813 | K41: =IF(R[-27]C="","",R[-27]C*R26C14) -> 0.61603701759560192 | L41: =IF(R[-27]C="","",R[-27]C*R27C14) -> 0.77899271763036859 | M41: =IF(R[-27]C="","",R[-27]C*R28C14) -> 0.50532481363152293 | N41: =IF(RC[-10]="","",SUM(RC[-10]:RC[-1])) -> 6.7011947732864865 | O41: =IF(RC[-1]="","",RC[-1]/R[-13]C14) -> 13.261163102457346
M42: count | N42: =COUNTA(R[-37]C[-11]:R[-29]C[-11]) -> 9
M43: lambda max | N43: =(SUM(R[-11]C:R[-3]C))/(COUNT(R[-11]C:R[-3]C)) -> 1.8038877322742097
M44: CI | N44: =(R[-1]C-R[-2]C)/(R[-2]C-1) -> -0.89951403346572378
M45: CR | N45: =R[-1]C/R[1]C -> -0.62035450583843021
M46: constant | N46: =IF(R[-4]C=R[5]C[-11],R[5]C[-10],IF(R[-4]C=R[6]C[-11],R[6]C[-10],IF(R[-4]C=R[7]C[-11],R[7]C[-10],IF(R[-4]C=R[8]C[-11],R[8]C[-10],IF(R[-4]C=R[9]C[-11],R[9]C[-10],IF(R[-4]C=R[10]C[-11],R[10]C[-10],IF(R[-4]C=R[11]C[-11],R[11]C[-10],IF(R[-4]C=R[12]C[-11],R[12]C[-10],R[13]C[-10])))))))) -> 1.45
C48: Saaty’s CIr values for matrices are given by the following table
C49: Size of Matrix | D49: Random Consistency (CIr)
C50: 1 | D50: 0 | E50: 1
C51: 2 | D51: 0 | E51: 2
C52: 3 | D52: 0.57999999999999996 | E52: 3
C53: 4 | D53: 0.9 | E53: 4
C54: 5 | D54: 1.1200000000000001 | E54: 5
C55: 6 | D55: 1.24 | E55: 6
C56: 7 | D56: 1.32 | E56: 7
C57: 8 | D57: 1.41 | E57: 8
C58: 9 | D58: 1.45 | E58: 9
C59: 10 | D59: 1.49 | E59: 10